libelle;longitude;latitude;code_commune_station;libelle_commune
L'Ouche à Trouhans;5.278999701;47.152921778;21645;TROUHANS
L'Ouche à Crimolois;5.117437141;47.266385644;21213;CRIMOLOIS
La Vouge à Vougeot;4.960810797;47.178697682;21716;VOUGEOT
La Vouge à Saint-Bernard;5.015163512;47.149098952;21542;SAINT-BERNARD
La Vouge à Saint-Nicolas-lès-Cîteaux [Abbaye-de-Cîteaux];5.098563475;47.124921017;21564;SAINT-NICOLAS-LES-CITEAUX
La Vouge à Aubigny-en-Plaine;5.179465454;47.134052423;21031;AUBIGNY-EN-PLAINE
La Sansfond [Cent Fonts] à Saulon-la-Rue;5.070201486;47.221975807;21586;SAULON-LA-RUE
[Le ru du Pâquier] à Saulon-la-Rue [Paquier de Potu];5.042195595;47.235341853;21586;SAULON-LA-RUE
Le Chairon à Noiron-sous-Gevrey;5.083394682;47.199125652;21458;NOIRON-SOUS-GEVREY
La Varaude à Izeure [Tarsul];5.118599105;47.179412287;21319;IZEURE
La Biètre à Brazey-en-Plaine;5.216040627;47.130197794;21103;BRAZEY-EN-PLAINE
La Saône à Pagny-la-Ville [Lechatelet];5.149223679;47.066763843;21474;PAGNY-LA-VILLE
Le Doubs à Mouthe;6.208958855;46.704902046;25413;MOUTHE
Le Doubs à Labergement-Sainte-Marie;6.2799151;46.773115418;25320;LABERGEMENT-SAINTE-MARIE
Le Doubs à Oye-et-Pallet;6.334042549;46.848329602;25442;OYE-ET-PALLET
Le Doubs à Saint-Point-Lac;6.304169618;46.811459483;25525;SAINT-POINT-LAC
Le Bief Rouge à Métabief;6.360307737;46.774171138;25380;METABIEF
Le Bief Rouge à Longevilles-Mont-d'Or;6.317806679;46.758500216;25348;LONGEVILLES-MONT-D'OR
Le Bief Rouge à Longevilles-Mont-d'Or;6.317972285;46.758506874;25348;LONGEVILLES-MONT-D'OR
La Taverne à Remoray-Boujeons;6.246960801;46.758560727;25486;REMORAY-BOUJEONS
Le ruisseau du Lhaut à Labergement-Sainte-Marie;6.26295045;46.757774062;25320;LABERGEMENT-SAINTE-MARIE
Le Remoray à Remoray-Boujeons;6.250357196;46.764033835;25486;REMORAY-BOUJEONS
Le Doubs à la Cluse-et-Mijoux [Pontarlier amont];6.364649964;46.881341249;25157;CLUSE-ET-MIJOUX
Le Doubs à Pontarlier [Ville];6.356467396;46.906011226;25462;PONTARLIER
Le Doubs à Doubs;6.348005496;46.927777568;25204;DOUBS
Le Doubs à Doubs;6.348005496;46.927777568;25204;DOUBS
Le Drugeon à Vuillecin;6.331314947;46.940625361;25634;VUILLECIN
Le Drugeon à Vuillecin;6.326098374;46.936675806;25634;VUILLECIN
Le Drugeon à Vuillecin;6.342931334;46.943409357;25634;VUILLECIN
Le Drugeon à la Rivière-Drugeon;6.221434045;46.867677576;25493;RIVIERE-DRUGEON
Le Drugeon à la Rivière-Drugeon;6.221504676;46.867846651;25493;RIVIERE-DRUGEON
Le Drugeon à Bonnevaux;6.192101212;46.809192411;25075;BONNEVAUX
Le Drugeon à Vaux-et-Chantegrue;6.247838164;46.812407094;25592;VAUX-ET-CHANTEGRUE
Le Drugeon à Vaux-et-Chantegrue;6.245275248;46.817390743;25592;VAUX-ET-CHANTEGRUE
La Jougnena à Jougne [La Ferrière];6.379588269;46.739205625;25318;JOUGNE
La Jougnena à Jougne [La Ferrière];6.382564861;46.733332033;25318;JOUGNE
Le Théverot à Grand'Combe-Châteleu [Châteleu];6.57518905;47.030688503;25285;GRAND'COMBE-CHATELEU
Le Doubs à Ville-du-Pont;6.476524405;47.000934809;25620;VILLE-DU-PONT
Le Doubs à Ville-du-Pont;6.480316889;47.002956319;25620;VILLE-DU-PONT
Le Doubs à Arçon;6.384899965;46.947039076;25024;ARCON
Le Doubs à Fournet-Blancheroche [La Rasse];6.842972061;47.154845235;25255;FOURNET-BLANCHEROCHE
Le Doubs à Fournet-Blancheroche [Chatelot];6.741175026;47.104635616;25255;FOURNET-BLANCHEROCHE
Le Doubs à Goumois;6.950266415;47.271432129;25280;GOUMOIS
Le Doubs à Fournet-Blancheroche [Refrain];6.873403925;47.187532345;25255;FOURNET-BLANCHEROCHE
Le Doubs à Charmauvillers [La Goule];6.925731083;47.224582956;25124;CHARMAUVILLERS
Le Doubs à Glère [Courclavon];7.026284031;47.343833984;25275;GLERE
Le Doubs à Soulce-Cernay;6.858613879;47.326200465;25551;SOULCE-CERNAY
Le Dessoubre à Rosureux;6.644930707;47.208407855;25504;ROSUREUX
Le Dessoubre à Rosureux;6.686531843;47.218735021;25504;ROSUREUX
Le Dessoubre à Saint-Hippolyte;6.79407373;47.305237894;25519;SAINT-HIPPOLYTE
Le Dessoubre à Plaimbois-du-Miroir [Gigot Dessoubre];6.61651644;47.201034606;25456;PLAIMBOIS-DU-MIROIR
La Reverotte à Plaimbois-du-Miroir [Gigot Reverotte];6.615708417;47.201997112;25456;PLAIMBOIS-DU-MIROIR
Le Doubs à Villars-sous-Dampjoux;6.759028816;47.348584383;25617;VILLARS-SOUS-DAMPJOUX
Le Doubs à Mathay;6.785827817;47.439382819;25370;MATHAY
Le Gland à Meslières;6.889803518;47.414289335;25378;MESLIERES
Le Gland à Seloncourt;6.860539124;47.461445652;25539;SELONCOURT
La Doue à Glay [Papeterie];6.908382708;47.403778819;25274;GLAY
La Bourbeuse [Le Saint-Nicolas] à Rougemont-le-Château;6.949659513;47.738488182;90089;ROUGEMONT-LE-CHATEAU
La Bourbeuse [Le Saint-Nicolas] à Rougemont-le-Château;6.949947403;47.738560696;90089;ROUGEMONT-LE-CHATEAU
La Bourbeuse à Fontaine [Les grands champs];6.990450091;47.658715445;90047;FONTAINE
La Bourbeuse à Montreux-Château [La petite fin];7.002521497;47.603451709;90071;MONTREUX-CHATEAU
La Bourbeuse [Le Saint-Nicolas] à Foussemagne;6.998786121;47.636115366;90049;FOUSSEMAGNE
La Madeleine à Étueffont;6.920558651;47.725733544;90041;ETUEFFONT
L'Autruche à Fontenelle [Puits];6.956731508;47.621569597;90048;FONTENELLE
L'Autruche à Fontenelle [Puits];6.954806113;47.621490667;90048;FONTENELLE
L'Autruche à Roppe;6.917358184;47.669535186;90087;ROPPE
La Bourbeuse à Froidefontaine;6.943392964;47.566279294;90051;FROIDEFONTAINE
La Feschotte à Badevel;6.940630713;47.499255309;25040;BADEVEL
L'Allan à Fesches-le-Châtel;6.880824761;47.523272525;25237;FESCHES-LE-CHATEL
L'Allan à Joncherey;6.997935978;47.526242546;90056;JONCHEREY
L'Allan à Morvillars [Graviers Rançon];6.944746547;47.544044474;90072;MORVILLARS
La Savoureuse à Giromagny;6.827486639;47.741189164;90052;GIROMAGNY
La Savoureuse à Belfort;6.859178988;47.640841209;90010;BELFORT
La Savoureuse à Vieux-Charmont;6.843898881;47.521910444;25614;VIEUX-CHARMONT
Le Rhôme à Lachapelle-sous-Chaux [Lachapelle Bis];6.81643413;47.704983275;90057;LACHAPELLE-SOUS-CHAUX
Le Rhôme à Lachapelle-sous-Chaux [Lachapelle Bis];6.81643413;47.704983275;90057;LACHAPELLE-SOUS-CHAUX
La Rosemontoise à Riervescemont [Rosemont];6.862081199;47.761913235;90085;RIERVESCEMONT
La Rosemontoise à Chaux;6.86294873;47.706681387;90023;CHAUX
La Rosemontoise à Rougegoutte;6.845634214;47.728699148;90088;ROUGEGOUTTE
La Douce à Bermont;6.856292397;47.581197052;90011;BERMONT
La Lizaine à Héricourt;6.742955595;47.581474511;70285;HERICOURT
L'Allan à Courcelles-lès-Montbéliard;6.772997717;47.500563537;25170;COURCELLES-LES-MONTBELIARD
L'Allan à Montbéliard;6.807723674;47.504903375;25388;MONTBELIARD
L'Allan à Montbéliard;6.807723674;47.504903375;25388;MONTBELIARD
Le Rupt à Dung;6.752796456;47.50017103;25207;DUNG
Le Doubs à Voujeaucourt;6.761656591;47.47861894;25632;VOUJEAUCOURT
Le Doubs à Lougres;6.685705731;47.456535631;25350;LOUGRES
Le Lougres à Lougres;6.694236078;47.474630718;25350;LOUGRES
Le canal du Rhône au Rhin [Le Doubs] à Clerval;6.502831114;47.381574484;25156;PAYS DE CLERVAL
Le canal du Rhône au Rhin [Le Doubs] à Branne;6.459182682;47.374367098;25087;BRANNE
Le ruisseau de Soye à Soye;6.486886405;47.438091998;25553;SOYE
Le ruisseau de l'Abbaye à Étrappe [Les Trois Rois];6.565574839;47.464784682;25226;ETRAPPE
Le Buhin à Sancey-le-Grand;6.545593636;47.30741182;25529;SANCEY
Le Sesserant à Silley-Bléfond;6.343106684;47.32311805;25546;SILLEY-BLEFOND
Le Sesserant à Saint-Juan;6.326446462;47.308954967;25520;SAINT-JUAN
L'Audeux à Chaux-lès-Passavant [La Grâce Dieu];6.347122694;47.248989696;25141;CHAUX-LES-PASSAVANT
L'Audeux à Bremondans;6.394641173;47.235550922;25089;BREMONDANS
L'Audeux à Aïssey;6.326477421;47.257297144;25009;AISSEY
Le Sesserant à Pont-les-Moulins [Chatel];6.364397718;47.32939581;25465;PONT-LES-MOULINS
Le Sesserant à Pont-les-Moulins [Chatel];6.3649431;47.328994404;25465;PONT-LES-MOULINS
Le Cusancin à Cusance [source Noire];6.436719938;47.322347976;25183;CUSANCE
Le torrent des Alloz à Cusance [source Bleue];6.437578199;47.324368019;25183;CUSANCE
Le Cusancin à Guillon-les-Bains [Bains-de-Guillon];6.382585004;47.320631549;25299;GUILLON-LES-BAINS
Le torrent des Alloz à Cusance;6.439140096;47.323925268;25183;CUSANCE
Le Cusancin à Cusance;6.430823684;47.323189235;25183;CUSANCE
Le Cusancin à Baume-les-Dames;6.373432768;47.337981875;25047;BAUME-LES-DAMES
Le Cusancin à Baume-les-Dames;6.380840872;47.342163494;25047;BAUME-LES-DAMES
[La source de la Glaie noire] à Pont-les-Moulins;6.360381612;47.320078195;25465;PONT-LES-MOULINS
Le Doubs [Canal du Rhône au Rhin] à Esnans [Beaumerousse];6.337688683;47.340402621;25221;ESNANS
Le Gour à Champlive [Village];6.247506927;47.289278827;25116;CHAMPLIVE
Le Gour [dérivation souterraine] à Champlive;6.239335793;47.283560701;25116;CHAMPLIVE
Le Doubs [Canal du Rhône au Rhin] à Besançon;6.029963685;47.240272474;25056;BESANCON
[dérivation] à Chalèze;6.097044762;47.265014102;25111;CHALEZE
[La source d'Arcier] à Vaire-Arcier;6.118996756;47.268795257;25575;VAIRE
[La source Bergeret] à Vaire-Arcier;6.121318841;47.269804905;25575;VAIRE
[La source Bergeret] à Vaire-Arcier;6.119691635;47.269090685;25575;VAIRE
Le Doubs [source de la Mouillere] à Besançon;6.024325405;47.245136058;25056;BESANCON
Le Doubs [source de la Mouillere] à Besançon;6.024325405;47.245136058;25056;BESANCON
Le ruisseau des Marais [perte du creux sous roche] à Saône;6.107815408;47.215100825;25532;SAONE
Le ruisseau du Moulin à Besançon;6.024746709;47.248544697;25056;BESANCON
Le Doubs à Avanne-Aveney [Aveney];5.962270355;47.199175622;25036;AVANNE-AVENEY
L'Arne à Lavans-lès-Dole;5.624416134;47.156727563;39285;LAVANS-LES-DOLE
Le Doubs à Rochefort-sur-Nenon;5.562372404;47.122798815;39462;ROCHEFORT-SUR-NENON
Le Doubs à Dole;5.492700275;47.088525918;39198;DOLE
La Clauge à Villette-lès-Dole [Arcore];5.47869505;47.04142853;39573;VILLETTE-LES-DOLE
La Clauge à la Loye;5.539814245;47.03564142;39305;LOYE
La Loue à Vuillafans;6.227220153;47.055503394;25633;VUILLAFANS
La Loue à Ornans;6.146031779;47.106165088;25434;ORNANS
La Loue [source vasque] à Ouhans;6.299763929;47.010710128;25440;OUHANS
La Loue [source vasque] à Ouhans;6.299795337;47.010704671;25440;OUHANS
La Loue [source canal] à Ouhans;6.29891279;47.011620634;25440;OUHANS
La Loue à Ouhans;6.299828633;47.01071058;25440;OUHANS
Le Lison [source] à Nans-sous-Sainte-Anne;6.011198168;46.965143223;25420;NANS-SOUS-SAINTE-ANNE
Le Lison [source] à Nans-sous-Sainte-Anne;6.010485609;46.967024188;25420;NANS-SOUS-SAINTE-ANNE
Le Lison à Myon;5.957574122;47.031532466;25416;MYON
Le Lison à Myon;5.95738145;47.031810136;25416;MYON
Le Lison [La Sarrasine] à Nans-sous-Sainte-Anne;6.008480753;46.965633692;25420;NANS-SOUS-SAINTE-ANNE
Le Lison [La source du Verneau] à Nans-sous-Sainte-Anne;6.002437811;46.978152924;25420;NANS-SOUS-SAINTE-ANNE
Le ruisseau de Boujaille à Boujailles;6.096065648;46.883986089;25079;BOUJAILLES
La Loue à Chenecey-Buillon;5.9570652;47.139352579;25149;CHENECEY-BUILLON
La Loue à Chenecey-Buillon;5.9570652;47.139352579;25149;CHENECEY-BUILLON
La Loue à Champagne-sur-Loue;5.814983099;47.04354802;39095;CHAMPAGNE-SUR-LOUE
La Loue à Port-Lesney;5.823258163;47.004228556;39439;PORT-LESNEY
La Furieuse à Salins-les-Bains;5.878122946;46.942446568;39500;SALINS-LES-BAINS
Le Lizon supérieur à Dournon;5.972873303;46.925336936;39202;DOURNON
La Loue à Montbarrey [Les trois Ours];5.63033579;47.011364024;39350;MONTBARREY
La Loue [totale] à Parcey;5.496123438;47.014552118;39405;PARCEY
La Loue [rivière] à Parcey;5.495038761;47.015305208;39405;PARCEY
[canal du moulin] à Parcey;5.482487631;47.017890859;39405;PARCEY
La Cuisance à Bans;5.589769371;46.991823818;39037;BANS
La Cuisance aux Planches-près-Arbois;5.81451505;46.879195198;39425;PLANCHES-PRES-ARBOIS
La Cuisance à Mesnay;5.803402079;46.890888109;39325;MESNAY
La Cuisance à Vaudrey [Champs levés];5.614881666;46.984059638;39546;VAUDREY
L'Orain au Deschaux;5.506086359;46.963044882;39193;DESCHAUX
Le Doubs à Neublans-Abergement;5.350597382;46.921642545;39385;NEUBLANS-ABERGEMENT
Le Doubs à Navilly;5.150351156;46.939640025;71329;NAVILLY
La Guyotte à Charette-Varennes [Quintin];5.185131757;46.886213383;71101;CHARETTE-VARENNES
La Guyotte à Saint-Bonnet-en-Bresse;5.177108652;46.86867532;71396;SAINT-BONNET-EN-BRESSE
Le canal du Centre à Essertenne;4.570336522;46.801463077;71191;ESSERTENNE
La Dheune à Santenay;4.70633424;46.908442319;21582;SANTENAY
La Dheune à Palleau;5.029409192;46.951902146;71341;PALLEAU
Le Meuzin à Villars-Fontaine;4.883818732;47.155949422;21688;VILLARS-FONTAINE
Le Meuzin [Source de Breuil à Messanges] à Messanges;4.875605177;47.16726756;21407;MESSANGES
La Lauve à Ladoix-Serrigny [source de Ladoix];4.875648128;47.072600376;21606;LADOIX-SERRIGNY
Le Rhoin à Bouilland [Combe Portaud];4.775541095;47.116435109;21092;BOUILLAND
Le Meuzin à Corgengoux;4.988436831;46.987154947;21193;CORGENGOUX
La Saône à Verdun-sur-le-Doubs;5.03308387;46.898401944;71566;VERDUN-SUR-LE-DOUBS
La Saône à Verdun-sur-le-Doubs;5.023020526;46.902793627;71566;VERDUN-SUR-LE-DOUBS
La Saône à Chalon-sur-Saône [port fluvial];4.875048166;46.788007803;71076;CHALON-SUR-SAONE
La Talie à la Loyère;4.828163944;46.837403779;71265;LOYERE
La Grosne Occidentale à Trades [Les Chambosses];4.55834951;46.275810547;69251;TRADES
La Grosne à Jalogny [Cluny];4.648603195;46.404154481;71240;JALOGNY
La Guye à Sigy-le-Châtel [Corcelles];4.563819268;46.557779145;71521;SIGY-LE-CHATEL
La Grosne à Sercy;4.695128707;46.600680692;71515;SERCY
La Saône à Tournus;4.917976082;46.555481248;71543;TOURNUS
La Seille à Voiteur [amont];5.612181352;46.75862492;39582;VOITEUR
La Seille à Arlay;5.51991532;46.760154704;39017;ARLAY
La Seille à Voiteur [aval];5.616578067;46.755200534;39582;VOITEUR
La Seille à Voiteur [aval];5.616578067;46.755200534;39582;VOITEUR
La Brenne à Sellières [les forges Baudin];5.572247874;46.824884398;39508;SELLIERES
La Brenne à Sens-sur-Seille [L'Estalet];5.29246665;46.749083329;71514;SENS-SUR-SEILLE
La Seille à Saint-Usuge;5.258379179;46.674102213;71484;SAINT-USUGE
Le Solnan à Verjon [Village];5.349974049;46.344858355;1432;VERJON
Le Solnan à Verjon [Village];5.358238945;46.342552597;1432;VERJON
Le Solnan à Domsure;5.276820044;46.437399835;1147;DOMSURE
Le Besançon à Montagna-le-Reconduit;5.387016233;46.456445808;39346;MONTAGNA-LE-RECONDUIT
Le Sevron à Bény;5.280759767;46.315599405;1038;BENY
Le Sevron à Varennes-Saint-Sauveur;5.243610436;46.500880247;71558;VARENNES-SAINT-SAUVEUR
La Gizia à Frontenaud;5.28178521;46.554597327;71209;FRONTENAUD
Le Sevron à Saint-Étienne-du-Bois [Pont du Chatelet];5.288179754;46.290650139;1350;SAINT-ETIENNE-DU-BOIS
La Vallière à Lons-le-Saunier;5.563931546;46.672164089;39300;LONS-LE-SAUNIER
La Vallière à Montmorot;5.510813936;46.677087044;39362;MONTMOROT
La Vallière à Savigny-en-Revermont;5.423408781;46.628069385;71506;SAVIGNY-EN-REVERMONT
La Vallière à Sagy;5.307843403;46.596980909;71379;SAGY
La Seille à Louhans;5.219372012;46.629662597;71263;LOUHANS
Le ru de Bissy à Bissy-la-Mâconnaise;4.790924989;46.478487394;71035;BISSY-LA-MACONNAISE
La Reyssouze [Source] à Journans;5.330753535;46.143007226;1197;JOURNANS
La Reyssouze à Montagnat;5.289964753;46.171511591;1254;MONTAGNAT
La Reyssouze à Bourg-en-Bresse [Majornas];5.222298789;46.227058678;1053;BOURG-EN-BRESSE
La Reyssouze à Saint-Julien-sur-Reyssouze;5.108671397;46.400607013;1367;SAINT-JULIEN-SUR-REYSSOUZE
La Veyle à Lent;5.198749522;46.119578372;1211;LENT
Le Vieux Jonc à Buellas [Corgenon];5.141201476;46.192824866;1065;BUELLAS
La Veyle à Vonnas [Vonnas];4.980969303;46.225428252;1457;VONNAS
La Veyle à Biziat [gourt des parties];4.950840959;46.237236258;1046;BIZIAT
La Veyle à Biziat [gourt des parties];4.951800512;46.23611255;1046;BIZIAT
Le Renon à Neuville-les-Dames;4.996907877;46.157087217;1272;NEUVILLE-LES-DAMES
La Saône à Mâcon [amont];4.830241937;46.296770588;71270;MACON
La Saône à Sancé [Macon, ultra-sons];4.850896579;46.341254427;71497;SANCE
La Saône à Sancé [Macon, ultra-sons];4.850896579;46.341254427;71497;SANCE
La Saône à Dracé [échelle aval de Macon];4.798380152;46.157340833;69077;DRACE
Le Denante à Davayé;4.765032394;46.301634506;71169;DAVAYE
La Chalaronne à Villars-les-Dombes;5.028446513;45.998314215;1443;VILLARS-LES-DOMBES
La Chalaronne à Châtillon-sur-Chalaronne;4.957533859;46.117265136;1093;CHATILLON-SUR-CHALARONNE
L'Ardière à Beaujeu;4.586590203;46.154461353;69018;BEAUJEU
La Morcille à Villié-Morgon [Pont des Versauds];4.662131602;46.156056274;69267;VILLIE-MORGON
La Vauxonne à Saint-Georges-de-Reneins [Pont de Bouchanin];4.738394594;46.071428393;69206;SAINT-GEORGES-DE-RENEINS
La Vauxonne à Saint-Étienne-des-Oullières [Buyon];4.673608135;46.05938775;69197;SAINT-ETIENNE-DES-OULLIERES
Le Morgon à Villefranche-sur-Saône;4.73561094;45.986984504;69264;VILLEFRANCHE-SUR-SAONE
L'Azergues à Chamelet;4.498868472;45.996624404;69039;CHAMELET
L'Azergues à Châtillon;4.643269751;45.874208759;69050;CHATILLON
Le Soanan à Saint-Vérand [La Tracole];4.509704859;45.909278869;69239;SAINT-VERAND
La Brévenne à Sain-Bel;4.600100499;45.810690963;69171;SAIN-BEL
La Turdine à l'Arbresle [Gobelette];4.602167235;45.83752883;69010;ARBRESLE
L'Azergues à Lozanne;4.687732675;45.858710077;69121;LOZANNE
[Le ruisseau de Fontjard] à Morancé [Saint-Pierre];4.686314266;45.891588703;69140;MORANCE
L'Azergues à Morancé;4.729879156;45.887669973;69140;MORANCE
La Saône à Trévoux;4.773170497;45.939988602;1427;TREVOUX
La Saône à Couzon-au-Mont-d'Or;4.8349165;45.848786527;69068;COUZON-AU-MONT-D'OR
La Saône à Couzon-au-Mont-d'Or;4.835490522;45.847056799;69068;COUZON-AU-MONT-D'OR
La Saône à Couzon-au-Mont-d'Or;4.834336332;45.844517459;69068;COUZON-AU-MONT-D'OR
La Saône à Couzon-au-Mont-d'Or;4.834336332;45.844517459;69068;COUZON-AU-MONT-D'OR
La Saône à Lyon [Pont La Feuillée];4.830534574;45.766053282;69123;LYON
L'Arve à Chamonix-Mont-Blanc [Pont des Favrands];6.859323241;45.915860508;74056;CHAMONIX-MONT-BLANC
L'Arve à Chamonix-Mont-Blanc [Pont de l'Aiguille];6.868145305;45.919904553;74056;CHAMONIX-MONT-BLANC
L'Arve à Chamonix-Mont-Blanc [Pont de l'Aiguille];6.868145305;45.919904553;74056;CHAMONIX-MONT-BLANC
L'Arve à Chamonix-Mont-Blanc [Pont de l'Aiguille];6.868145305;45.919904553;74056;CHAMONIX-MONT-BLANC
La Diosaz aux Houches;6.769210673;45.930846156;74143;HOUCHES
Le Bon Nant à Saint-Gervais-les-Bains;6.702736638;45.906871143;74236;SAINT-GERVAIS-LES-BAINS
Le Bon Nant à Saint-Gervais-les-Bains;6.702727622;45.906860342;74236;SAINT-GERVAIS-LES-BAINS
L'Arve à Sallanches;6.641934883;45.940461634;74256;SALLANCHES
L'Arve à Passy;6.673404974;45.920242599;74208;PASSY
[Le Nant d'Orlier] à Magland [chez Party];6.617518191;46.03076706;74159;MAGLAND
[Le Nant du Crêt] à Magland [chez Gaudy];6.617410104;46.028534947;74159;MAGLAND
Le Giffre à Samoëns;6.718719133;46.076179604;74258;SAMOENS
Le Giffre à Samoëns;6.718719133;46.076179604;74258;SAMOENS
Le Giffre à Mieussy;6.552017739;46.11422724;74183;MIEUSSY
Le Giffre à Mieussy;6.551947242;46.114139306;74183;MIEUSSY
Le Giffre à Mieussy [Taninges-Pressy-QNR];6.552017739;46.11422724;74183;MIEUSSY
Le Giffre à Marignier [Plan séraphin];6.497386575;46.118276897;74164;MARIGNIER
Le Giffre à Marignier [Plan séraphin];6.492433145;46.122559536;74164;MARIGNIER
Le Risse à Saint-Jeoire [Pont du Risse];6.475756168;46.136555707;74241;SAINT-JEOIRE
Le Risse à Saint-Jeoire [Pont du Risse];6.475824015;46.136461936;74241;SAINT-JEOIRE
Le Bronze à Bonneville;6.456175611;46.064872523;74042;BONNEVILLE
Le Bronze à Bonneville;6.455069475;46.068079004;74042;BONNEVILLE
Le Borne à Saint-Jean-de-Sixt;6.418470415;45.936304423;74239;SAINT-JEAN-DE-SIXT
L'Arve à Bonneville;6.405936393;46.076794353;74042;BONNEVILLE
L'Arve à Reignier-Ésery [Arthaz];6.271047706;46.150604321;74220;REIGNIER-ESERY
La Menoge à Vétraz-Monthoux;6.272951834;46.169692218;74298;VETRAZ-MONTHOUX
La Menoge à Bonne [Pont D 198];6.320774188;46.165726497;74040;BONNE
L'Aire à Saint-Julien-en-Genevois [Thairy];6.066317751;46.140267216;74243;SAINT-JULIEN-EN-GENEVOIS
La Dranse à Vacheresse;6.674328701;46.315260447;74286;VACHERESSE
La Dranse à Vacheresse;6.666920757;46.326623059;74286;VACHERESSE
L'Ugine à Saint-Paul-en-Chablais;6.641790924;46.353525693;74249;SAINT-PAUL-EN-CHABLAIS
La Dranse de Morzine à la Baume [Pont de Couvaloup];6.620492166;46.265107873;74030;BAUME
La Dranse à Reyvroz [Bioge];6.585798102;46.326297496;74222;REYVROZ
Le Redon à Margencel;6.415931155;46.339302142;74163;MARGENCEL
Le Foron à Sciez;6.381285809;46.330403257;74263;SCIEZ
L'Allondon à Saint-Genis-Pouilly;6.014197508;46.239256376;1354;SAINT-GENIS-POUILLY
L'Allondon à Échenevex [Naz-Dessous];6.028608342;46.298583152;1153;ECHENEVEX
Le Lion à Prévessin-Moëns [Vesegnin];6.058178262;46.262395533;1313;PREVESSIN-MOENS
Le Rhône à Pougny;5.963664346;46.143957314;1308;POUGNY
Le Rhône à Pougny;5.964334247;46.137640984;1308;POUGNY
La Valserine à Lélex [Niaizet];5.921921494;46.282474777;1210;LELEX
La Valserine à Chézery-Forens [Les Hirondelles];5.891832778;46.244568634;1104;CHEZERY-FORENS
La Valserine à Chézery-Forens [Chézery];5.86571257;46.221759013;1104;CHEZERY-FORENS
La Semine à Châtillon-en-Michaille [Coz];5.800454684;46.149838689;1091;CHATILLON-EN-MICHAILLE
La Semine à Saint-Germain-de-Joux [Les Marionnettes];5.738727802;46.182483546;1357;SAINT-GERMAIN-DE-JOUX
La Valserine à Lancrans [Moulin de Métral];5.824552233;46.120561029;1205;LANCRANS
La Valserine à Lancrans [Le Viret];5.82151635;46.125024715;1205;LANCRANS
Le Rhône à Surjoux;5.810166537;46.020999732;1413;SURJOUX
Les Usses à Musièges [Pont des Douattes];5.964823139;46.006595595;74195;MUSIEGES
Les Usses à Musièges [Pont des Douattes];5.958177538;46.005417672;74195;MUSIEGES
Les Usses à Frangy;5.933723519;46.017038302;74131;FRANGY
Les Usses à Usinens [CNR];5.869246027;46.017238919;74285;USINENS
Le Rhône à Corbonod [Seyssel-CNR];5.832380668;45.967931835;1118;CORBONOD
Le Rhône à Corbonod [Seyssel-CNR];5.832380668;45.967931835;1118;CORBONOD
Le Fier à Dingy-Saint-Clair;6.206701506;45.905041931;74102;DINGY-SAINT-CLAIR
La Fillière à Argonay;6.166284129;45.955838256;74019;ARGONAY
La Fillière à Thorens-Glières;6.269763021;45.984836012;74282;FILLIERE
L'Ire à Doussard;6.224642713;45.783017003;74104;DOUSSARD
Le ruisseau de Bornette à Doussard;6.204494971;45.77388493;74104;DOUSSARD
Le ruisseau de Bornette à Lathuile;6.209140233;45.785784311;74147;LATHUILE
L'Eau Morte à Doussard;6.231537396;45.787695415;74104;DOUSSARD
Le Laudon à Saint-Jorioz;6.16489329;45.835015066;74242;SAINT-JORIOZ
Le ruisseau de Tami à Plancherine [Source du Bonté];6.300997993;45.675196897;73202;PLANCHERINE
Le Chéran à Allèves [La Charniaz];6.103395254;45.720649533;74004;ALLEVES
[Le Nant de la Combe] à Allèves;6.098708731;45.735278515;74004;ALLEVES
Le ruisseau des Eparis à Alby-sur-Chéran;6.030500321;45.823932233;74002;ALBY-SUR-CHERAN
La Néphaz à Rumilly;5.943905972;45.863692106;74225;RUMILLY
Le ruisseau de Cherel à Jarsy [Source de la Touvière];6.198986475;45.67056256;73139;JARSY
Le Rhône à Ruffieux [Pont de la Loi];5.803715344;45.848615249;73218;RUFFIEUX
Le Fier à Motz;5.84107625;45.932869298;73180;MOTZ
Le Fier à Vallières;5.920634224;45.902097655;74289;VALLIERES
Le Rhône à Anglefort [Entrant Chautagne];5.82548015;45.934449353;1010;ANGLEFORT
Le ruisseau de Belle Eau à Voglans;5.892354317;45.633073665;73329;VOGLANS
Le Tillet à Aix-les-Bains;5.906006742;45.668053653;73008;AIX-LES-BAINS
[Le captage de Saint Victor] à Mouxy [1];5.962934178;45.673165862;73182;MOUXY
[Le captage de Saint Victor] à Mouxy [2];5.960197773;45.67535547;73182;MOUXY
[Le captage Fresenex] à Drumettaz-Clarafond;5.947524295;45.669821742;73103;DRUMETTAZ-CLARAFOND
[Le captage de la Croze] à Méry;5.936449826;45.633823665;73155;MERY
La Leysse à la Motte-Servolex [Pont du Tremblay];5.873078319;45.628179142;73179;MOTTE-SERVOLEX
La Leysse à la Ravoire et à Saint-Alban-Leysse;5.976427082;45.581102985;73222;SAINT-ALBAN-LEYSSE
La Leysse à la Ravoire et à Saint-Alban-Leysse;5.963350814;45.573256125;73213;RAVOIRE
La Leysse à la Ravoire et à Saint-Alban-Leysse;5.963994544;45.573425478;73213;RAVOIRE
L'Hyère à Chambéry [Charrière-Neuve];5.908095695;45.578431324;73065;CHAMBERY
L'Hyère à Chambéry [Charrière-Neuve];5.905249159;45.573679186;73065;CHAMBERY
L'Albanne à Chambéry [Pont Chevalier];5.934427506;45.566095727;73065;CHAMBERY
L'Albanne à Chambéry [Pont Chevalier];5.937386626;45.565045226;73065;CHAMBERY
[La source de Lovettaz] à Saint-Jean-d'Arvey;5.984453263;45.603373101;73243;SAINT-JEAN-D'ARVEY
Le Varon au Bourget-du-Lac;5.859046953;45.641476003;73051;BOURGET-DU-LAC
Le ruisseau Nant Bruyant à la Motte-Servolex;5.86980537;45.587326932;73179;MOTTE-SERVOLEX
Le ruisseau Forezan à Cognin;5.889732357;45.557729636;73087;COGNIN
Le ruisseau des Combes au Bourget-du-Lac;5.859767421;45.63925908;73051;BOURGET-DU-LAC
Le Varon au Bourget-du-Lac [Captage de la Roche];5.839235505;45.624379889;73051;BOURGET-DU-LAC
L'Hyère à Chambéry [Pont d'Hyère];5.905249159;45.573679186;73065;CHAMBERY
Le Sierroz à Aix-les-Bains;5.905108099;45.70650851;73008;AIX-LES-BAINS
Le Sierroz à Aix-les-Bains;5.903425817;45.705821994;73008;AIX-LES-BAINS
La Meunaz à Montcel;5.961918039;45.732702511;73164;MONTCEL
La Monderesse à Saint-Ours;5.973138196;45.741544494;73265;SAINT-OURS
Le Sierroz à Grésy-sur-Aix;5.927562204;45.723967339;73128;GRESY-SUR-AIX
La Deisse à Grésy-sur-Aix;5.921181475;45.727872506;73128;GRESY-SUR-AIX
[Captage Bermond] à Trévignin;5.97487329;45.708030893;73301;TREVIGNIN
[Captage Le Coutens] à Montcel;6.004516898;45.713173654;73164;MONTCEL
