libelle;longitude;latitude;code_commune_station;libelle_commune
La Claise à Chaumussay;0.862964387;46.871578961;37064;CHAUMUSSAY
La Claise au Grand-Pressigny [Pont de Fer];0.793280784;46.924613582;37113;GRAND-PRESSIGNY
L'Aigronne au Grand-Pressigny [Pont Saint Martin];0.805564315;46.916732783;37113;GRAND-PRESSIGNY
Le Brignon à Paulmy;0.813189844;46.978800854;37181;PAULMY
Le Brignon à Paulmy;0.826453661;46.981456392;37181;PAULMY
La Creuse à Descartes;0.694908264;46.972228152;37115;DESCARTES
L'Esves à Marcé-sur-Esves;0.656033245;47.030839081;37145;MARCE-SUR-ESVES
La Vienne à Nouâtre et à Pouzay;0.544852523;47.050101496;37174;NOUATRE
La Vienne à Nouâtre et à Pouzay;0.531462944;47.079766347;37188;POUZAY
La Manse à Crouzilles [La Couture];0.440139102;47.138545888;37093;CROUZILLES
La Veude à Lémeré [Moulin de Coutureau];0.305991973;47.100961755;37125;LEMERE
La Vienne à Chinon;0.238392936;47.165936556;37072;CHINON
Le Négron à Marçay;0.187296513;47.102870491;37144;MARCAY
La Loire à Montsoreau et à Saumur;0.048469814;47.222657079;49219;MONTSOREAU
La Loire à Montsoreau et à Saumur;-0.075428626;47.262418207;49328;SAUMUR
La Loire à Montsoreau et à Saumur;0.062725437;47.21563207;49219;MONTSOREAU
Le Thouet à Secondigny [Frécul];-0.399397341;46.60323422;79311;SECONDIGNY
Le Thouet au Tallud [La Pèchellerie];-0.299662895;46.626456218;79322;TALLUD
La Viette à Beaulieu-sous-Parthenay [Pont de la Borde];-0.257403785;46.588130131;79029;BEAULIEU-SOUS-PARTHENAY
La Viette à Parthenay;-0.263193443;46.623418501;79202;PARTHENAY
Le Palais au Tallud [Boisseau];-0.285745826;46.649206178;79322;TALLUD
Le Thouet à Châtillon-sur-Thouet et à Parthenay;-0.23206401;46.657329357;79202;PARTHENAY
Le Thouet à Châtillon-sur-Thouet et à Parthenay;-0.251120808;46.653176631;79202;PARTHENAY
Le Thouet à Châtillon-sur-Thouet et à Parthenay;-0.239345489;46.657403162;79080;CHATILLON-SUR-THOUET
Le Thouet à Châtillon-sur-Thouet et à Parthenay;-0.247095768;46.653298941;79202;PARTHENAY
Le Thouet à Saint-Loup-Lamairé [Pont de Saint-Loup];-0.166850805;46.786083352;79268;SAINT-LOUP-LAMAIRE
Le Thouet à Saint-Loup-Lamairé [Pont de Saint-Loup];-0.167852353;46.76977247;79268;SAINT-LOUP-LAMAIRE
Le Thouet à Saint-Loup-Lamairé [Pont de Saint-Loup];-0.172030814;46.763977532;79268;SAINT-LOUP-LAMAIRE
Le Cébron à Gourgé [Le Champ des Balastières];-0.219231593;46.728585067;79135;GOURGE
Le Cébron à Gourgé [Le Champ des Balastières];-0.211198356;46.752951926;79135;GOURGE
Le Cébron à Saint-Loup-Lamairé [Puy Terrier];-0.19111622;46.77429523;79268;SAINT-LOUP-LAMAIRE
Le Thouet à Saint-Généroux [Pont de Saint-Généroux];-0.139912183;46.883600346;79252;SAINT-GENEROUX
Le Thouaret à Faye-l'Abbesse [La Rochette];-0.347789199;46.823805383;79116;FAYE-L'ABBESSE
Le Thouaret à Luzay [La Planche];-0.186961428;46.92308205;79161;LUZAY
Le Thouet à Missé [Missé];-0.191248779;46.952492153;79178;MISSE
Le Thouet à Sainte-Radegonde [Vrines];-0.246205042;46.997211202;79292;SAINTE-RADEGONDE
[L'Argent] à Nueil-les-Aubiers [La Touche au Port];-0.647991139;46.914700999;79195;NUEIL-LES-AUBIERS
[L'Argent] à Nueil-les-Aubiers [La Touche au Port];-0.653968808;46.907976839;79195;NUEIL-LES-AUBIERS
La Scie à Nueil-les-Aubiers;-0.592457151;46.943395476;79195;NUEIL-LES-AUBIERS
L'Argenton à Massais [Moulin Bernard];-0.356461584;46.997660056;79168;MASSAIS
Le Thouet à Montreuil-Bellay;-0.154410668;47.135904691;49215;MONTREUIL-BELLAY
Le Thouet à Montreuil-Bellay;-0.142074829;47.144899181;49215;MONTREUIL-BELLAY
La Dive [du Nord] à Marnes [Moulin de Retournay];-0.014762845;46.865222184;79167;MARNES
Le canal de la Dive à Pouançay [La Motte Bourbon];-0.089621633;47.097294782;86196;POUANCAY
Le Thouet à Chacé;-0.080339787;47.215742716;49060;CHACE
Le Thouet à Chacé;-0.080336082;47.215744977;49060;CHACE
La Loire à Gennes et aux Ponts-de-Cé et à Saint-Mathurin-sur-Loire;-0.52167928;47.418661535;49246;PONTS-DE-CE
La Loire à Gennes et aux Ponts-de-Cé et à Saint-Mathurin-sur-Loire;-0.230904781;47.345018049;49149;GENNES
La Loire à Gennes et aux Ponts-de-Cé et à Saint-Mathurin-sur-Loire;-0.318663129;47.408685712;49307;LOIRE-AUTHION
Le Gravot à Bourgueil;0.181605662;47.320009227;37031;BOURGUEIL
Le Lane à Saint-Patrice;0.249109888;47.265770756;37232;COTEAUX-SUR-LOIRE
L'Authion à Benais;0.191417833;47.330209915;37024;BENAIS
[Le Changeon] à Gizeux [Moulin Foulon];0.205229692;47.354886504;37112;GIZEUX
L'Authion à Longué-Jumelles [ANCIENNE STATION 1967 a 1980];-0.20379613;47.376302666;49180;LONGUE-JUMELLES
Le Lathan à Rillé;0.248386673;47.452289576;37198;RILLE
Le bras du Lathan à Vernantes;-0.002479691;47.406605888;49368;VERNANTES
Le Lathan à Vernantes;-0.01532196;47.410870773;49368;VERNANTES
Le Lathan à Vernantes;-0.026256295;47.408203176;49368;VERNANTES
Le Couasnon à Pontigné [ANCIENNE STATION DE 1967 A 1984];-0.036364738;47.541373795;49245;PONTIGNE
Le Couasnon à Gée [ANCIENNE STATION - 1967 à 1983];-0.229350103;47.455923708;49147;GEE
Le Tarry à Mazé [ANCIENNE STATION - 1967 A 1983];-0.233705216;47.480299004;49194;MAZE-MILON
Le Couasnon à Beaufort-en-Vallée;-0.236387486;47.454998424;49021;BEAUFORT-EN-ANJOU
L'Authion aux Ponts-de-Cé [ancienne station 1967 -1972];-0.528167349;47.430692623;49246;PONTS-DE-CE
Les Aunaies à Bauné [ANCIENNE STATION - 1967 A 1978];-0.31917763;47.494752453;49019;BAUNE
La Sarthe au Mêle-sur-Sarthe;0.358036962;48.508819977;61258;MELE-SUR-SARTHE
L'Hoëne à la Mesnière [La Foulerie];0.440570488;48.547708617;61277;MESNIERE
La Vézone à Neuilly-le-Bisson et aux Ventes-de-Bourse;0.237349625;48.497802133;61304;NEUILLY-LE-BISSON
La Vézone à Neuilly-le-Bisson et aux Ventes-de-Bourse;0.231331085;48.49379134;61499;VENTES-DE-BOURSE
La Sarthe à Alençon;0.115348266;48.435378989;61001;ALENCON
La Sarthe à Mieuxcé et à Saint-Céneri-le-Gérei;0.013021022;48.399598249;61279;MIEUXCE
La Sarthe à Mieuxcé et à Saint-Céneri-le-Gérei;-0.023532875;48.385886744;61372;SAINT-CENERI-LE-GEREI
Le Sarthon [partiel] à la Ferrière-Bochard;-0.054381314;48.41129532;61165;FERRIERE-BOCHARD
Le Sarthon [bief] à la Ferrière-Bochard;-0.054381314;48.41129532;61165;FERRIERE-BOCHARD
Le Sarthon à Saint-Céneri-le-Gérei;-0.055109346;48.383114025;61372;SAINT-CENERI-LE-GEREI
Le Sarthon à la Roche-Mabile;-0.050292154;48.493669704;61350;ROCHE-MABILE
Le Sarthon à Ravigny [Les Vauguiberts];-0.057315332;48.429181114;53187;RAVIGNY
L'Ornette à Saint-Pierre-des-Nids [Larray];-0.091820182;48.375075837;53246;SAINT-PIERRE-DES-NIDS
Le Terrançon à Saint-Pierre-des-Nids [Pont des Terriers];-0.089378914;48.377228378;53246;SAINT-PIERRE-DES-NIDS
Le Merdereau à Saint-Paul-le-Gaultier [Chiantin];-0.147943596;48.330558155;72309;SAINT-PAUL-LE-GAULTIER
La Vaudelle à Saint-Georges-le-Gaultier;-0.10003153;48.292690799;72282;SAINT-GEORGES-LE-GAULTIER
L'Orthe à Douillet [Le Joly];-0.039730001;48.273510659;72121;DOUILLET
La Bienne à Thoiré-sous-Contensor;0.201461954;48.307302569;72355;THOIRE-SOUS-CONTENSOR
La Saosnette à Thoiré-sous-Contensor;0.203621077;48.307812767;72355;THOIRE-SOUS-CONTENSOR
La Sarthe à Beaumont-sur-Sarthe;0.130781016;48.223939285;72029;BEAUMONT-SUR-SARTHE
Le Tripoulin à Courcival;0.392072087;48.234579106;72102;COURCIVAL
Le Tripoulin à Courcival;0.392202248;48.234672005;72102;COURCIVAL
Le Tripoulin à Courcival;0.392888947;48.234138001;72102;COURCIVAL
La Dive à Mamers;0.373350442;48.339086691;72180;MAMERS
L'Orne Saosnoise à Montbizot;0.198336227;48.151974081;72205;MONTBIZOT
L'Orne Saosnoise à Montbizot;0.204939435;48.159666942;72205;MONTBIZOT
L'Orne Saosnoise à Montbizot;0.198987173;48.152385711;72205;MONTBIZOT
La Sarthe à Neuville-sur-Sarthe et à Souillé [Montreuil];0.205741737;48.090075926;72217;NEUVILLE-SUR-SARTHE
La Sarthe à Neuville-sur-Sarthe et à Souillé [Montreuil];0.18666737;48.116157411;72338;SOUILLE
La Sarthe au Mans [Yssoir];0.179180548;47.996173235;72181;MANS
La Sarthe au Mans [Yssoir];0.194845139;48.009956052;72181;MANS
L'Huisne à Réveillon [Moulin de Réveillon];0.563970007;48.470307942;61348;REVEILLON
La Commeauche à Maison-Maugis;0.704805457;48.453422437;61245;MAISON-MAUGIS
L'Huisne à Bellou-sur-Huisne et à Rémalard;0.769743726;48.426454834;61345;REMALARD EN PERCHE
L'Huisne à Dorceau;0.801929347;48.4202697;61147;DORCEAU
La Corbionne à Bretoncelles;0.871038719;48.403800808;61061;BRETONCELLES
L'Huisne à Margon;0.843677137;48.34953957;28236;MARGON
La Cloche à Margon;0.83863831;48.334804115;28236;MARGON
L'Huisne à Nogent-le-Rotrou [Pont de bois];0.813870132;48.318499403;28280;NOGENT-LE-ROTROU
La Rhône à Nogent-le-Rotrou;0.820735596;48.311407524;28280;NOGENT-LE-ROTROU
L'Huisne à Avezé et à la Ferté-Bernard;0.67417517;48.227929335;72020;AVEZE
L'Huisne à Avezé et à la Ferté-Bernard;0.657922969;48.197389239;72132;FERTE-BERNARD
L'Huisne à Avezé et à la Ferté-Bernard;0.649389319;48.187650585;72132;FERTE-BERNARD
La Même à Saint-Germain-de-la-Coudre et à Souvigné-sur-Même;0.62587433;48.245341168;61394;SAINT-GERMAIN-DE-LA-COUDRE
La Même à Saint-Germain-de-la-Coudre et à Souvigné-sur-Même;0.642595361;48.209857911;72342;SOUVIGNE-SUR-MEME
L'Huisne à Cherré [Les Ajeux];0.642991136;48.164216638;72080;CHERRE
L'Huisne à Connerré;0.490431666;48.060056683;72090;CONNERRE
La Tortue à Saint-Michel-de-Chavaignes [L'Onglée];0.54935712;48.029174407;72303;SAINT-MICHEL-DE-CHAVAIGNES
L'Huisne à Montfort-le-Gesnois [La Pécardière];0.405299492;48.041599681;72241;MONTFORT-LE-GESNOIS
Le Narais à Saint-Mars-la-Brière;0.399614955;48.002622565;72300;SAINT-MARS-LA-BRIERE
La Vive Parence à Yvré-l'Évêque [Parence];0.294592012;48.039863437;72386;YVRE-L'EVEQUE
L'Huisne au Mans [Pontlieue];0.210212986;47.984685043;72181;MANS
La Sarthe à Spay [Ecluse de Prélandon];0.144678112;47.912708336;72344;SPAY
La Sarthe à Spay [Ecluse de Prélandon];0.145059946;47.91258254;72344;SPAY
Le Roule Crotte à Arnage [Gué Gilet];0.199051923;47.935990806;72008;ARNAGE
Le Rhonne à Guécélard [La Soufflardière];0.151682027;47.887536941;72146;GUECELARD
La Sarthe à la Suze-sur-Sarthe [écluse];0.028293539;47.894599742;72346;SUZE-SUR-SARTHE
Le Fessard à Cérans-Foulletourte [Grand Mineloup];0.058053924;47.861892171;72051;CERANS-FOULLETOURTE
L'Orne Champenoise à Voivres-lès-le-Mans;0.080971868;47.92289408;72381;VOIVRES-LES-LE-MANS
La Gée à Fercé-sur-Sarthe [Planche Augis];-0.043282246;47.906004746;72131;FERCE-SUR-SARTHE
La Vézanne à Malicorne-sur-Sarthe;-0.084795551;47.810422167;72179;MALICORNE-SUR-SARTHE
Les Deux Fonts à Chantenay-Villedieu [Groteau];-0.177464354;47.932450764;72059;CHANTENAY-VILLEDIEU
Les Deux Fonts à Avoise [Gué Avezel];-0.205050275;47.870858339;72021;AVOISE
Le Berdin à Rouez [Foulleray];-0.075634979;48.13879009;72256;ROUEZ
Le Berdin à Tennie;-0.079498266;48.110899135;72351;TENNIE
La Vègre à Chevillé [Moulin le Pivot];-0.23899363;47.945154008;72083;CHEVILLE
La Vègre à Asnières-sur-Vègre;-0.231495969;47.888120323;72010;ASNIERES-SUR-VEGRE
L'Erve à Voutré [La Crousille];-0.322429245;48.132273828;53276;VOUTRE
Le Treulon à Auvers-le-Hamon [La Havardière];-0.342687429;47.925530734;72016;AUVERS-LE-HAMON
La Sarthe à Sablé-sur-Sarthe;-0.33193816;47.837614106;72264;SABLE-SUR-SARTHE
L'Erve à Auvers-le-Hamon [Moulin la Roche];-0.361832141;47.897096086;72016;AUVERS-LE-HAMON
L'Erve à Auvers-le-Hamon [Moulin la Roche];-0.362301345;47.898370764;72016;AUVERS-LE-HAMON
La Vaige à Bouessay;-0.380211483;47.868102789;53037;BOUESSAY
La Taude à Saint-Brice;-0.440438801;47.860604048;53203;SAINT-BRICE
La Sarthe à Saint-Denis-d'Anjou [Beffes];-0.385896895;47.803160223;53210;SAINT-DENIS-D'ANJOU
[La Voutonne] à Précigné;-0.341492449;47.766512398;72244;PRECIGNE
La Sarthe à Châteauneuf-sur-Sarthe;-0.486632182;47.678282349;49080;CHATEAUNEUF-SUR-SARTHE
La Sarthe à Cheffes;-0.502184763;47.622821516;49090;CHEFFES
Le Loir à Saint-Avit-les-Guespières;1.267569295;48.268907299;28326;SAINT-AVIT-LES-GUESPIERES
Le Loir à Alluyes;1.38170562;48.216599081;28005;ALLUYES
La Vallée de Paray à Bouville;1.389128538;48.256640566;28057;BOUVILLE
[La vallée de Boncé] à Montboissier;1.409055894;48.241602363;28259;MONTBOISSIER
L'Ozanne à Brou;1.162337575;48.210258113;28061;BROU
L'Ozanne à Trizay-lès-Bonneval [Prémoteux];1.347562486;48.209043583;28396;TRIZAY-LES-BONNEVAL
Le Loir à Saint-Maur-sur-le-Loir;1.417776498;48.151659008;28353;SAINT-MAUR-SUR-LE-LOIR
Le Loir à Bonneval;1.3839286;48.180072282;28051;BONNEVAL
La Conie à Conie-Molitard;1.452148669;48.121073819;28106;CONIE-MOLITARD
La Conie à Conie-Molitard;1.42082121;48.106942058;28106;CONIE-MOLITARD
Le Loir à Châteaudun;1.322957673;48.071919084;28088;CHATEAUDUN
L'Yerre à Saint-Hilaire-sur-Yerre [Bêchereau];1.25772333;48.030890833;28340;SAINT-HILAIRE-SUR-YERRE
L'Yerre à Saint-Denis-les-Ponts;1.239588675;48.054446915;28334;SAINT-DENIS-LES-PONTS
Le Loir à Cloyes-sur-le-Loir;1.233667018;47.996138386;28103;CLOYES-LES-TROIS-RIVIERES
L'Aigre à Romilly-sur-Aigre;1.304788322;47.985528285;28318;ROMILLY-SUR-AIGRE
L'Aigre à Romilly-sur-Aigre;1.304704279;47.985611225;28318;ROMILLY-SUR-AIGRE
Le Loir à Morée;1.213437784;47.918337649;41154;MOREE
Le Loir à Vendôme;1.06011064;47.79395564;41269;VENDOME
Le Loir à Villavard;0.890287589;47.759049007;41274;VILLAVARD
La Braye à Valennes [La Caboche];0.819596601;48.014316848;72366;VALENNES
Le Couétron à Souday;0.849758368;48.053977701;41248;COUETRON-AU-PERCHE
La Braye [bras rive gauche] à Savigny-sur-Braye;0.803370041;47.879845008;41238;SAVIGNY-SUR-BRAYE
La Braye [bras rive droite] à Savigny-sur-Braye;0.80313156;47.879786524;41238;SAVIGNY-SUR-BRAYE
La Braye à Sargé-sur-Braye;0.841313574;47.911402572;41235;SARGE-SUR-BRAYE
L'Anillé à Saint-Gervais-de-Vic [La Cruchetière];0.742992451;47.886568244;72286;SAINT-GERVAIS-DE-VIC
Le Tusson à la Chapelle-Gaugain [Les Riverelles];0.667161471;47.801610311;72063;CHAPELLE-GAUGAIN
Le Loir à la Chartre-sur-le-Loir;0.573557609;47.729221009;72068;CHARTRE-SUR-LE-LOIR
La Veuve à Saint-Pierre-du-Lorouër [Petit Brives];0.536548447;47.798153415;72314;SAINT-PIERRE-DU-LOROUER
L'Etangsort à Courdemanche;0.564685066;47.814382377;72103;COURDEMANCHE
Le Loir à Flée [Port-Gautier];0.479911407;47.710698828;72134;FLEE
L'Escotais à Saint-Paterne-Racan;0.476991918;47.603299499;37231;SAINT-PATERNE-RACAN
Le Loir au Lude [Rue des ponts];0.161199767;47.6491854;72176;LUDE
L'Aune à Pontvallain [Casse Maillé];0.188532952;47.739280229;72243;PONTVALLAIN
L'Aune à Luché-Pringé [Moulin à Tan];0.100983752;47.712114356;72175;LUCHE-PRINGE
Le Casseau à Mansigné;0.125360693;47.746814741;72182;MANSIGNE
Le Loir à la Flèche [Mairie];-0.074739976;47.695735976;72154;FLECHE
Le Loir à Durtal;-0.245141568;47.669491388;49127;DURTAL
L'Argance à la Chapelle-d'Aligné [La Cheviraye];-0.21783474;47.717098262;72061;CHAPELLE-D'ALIGNE
Le Loir à Seiches-sur-le-Loir;-0.365782559;47.576661372;49333;SEICHES-SUR-LE-LOIR
La Mayenne à Pré-en-Pail [La Lande];-0.219163637;48.473184954;53185;PRE-EN-PAIL-SAINT-SAMSON
La Mayenne à Couptrain;-0.297284691;48.486824133;53080;COUPTRAIN
Le Tilleul à Lignières-Orgères [Les Senaillères];-0.233878823;48.522565169;53133;LIGNIERES-ORGERES
L'Aisne à Javron-les-Chapelles [Les Chapelles];-0.332268714;48.439025468;53121;JAVRON-LES-CHAPELLES
La Mayenne à Madré;-0.369389252;48.488590257;53142;MADRE
La Gourbe à Saint-Ouen-le-Brisoult [Les Hayes];-0.348414582;48.526478079;61439;SAINT-OUEN-LE-BRISOULT
La Mayenne à Couterne;-0.417184501;48.507808066;61135;COUTERNE
La Mayenne à Ambrières-les-Vallées [Cigné];-0.586379295;48.445247302;53003;AMBRIERES-LES-VALLEES
La Varenne à Domfront;-0.661980418;48.587682296;61145;DOMFRONT EN POIRAIE
La Varenne au Châtellier [La Fonte];-0.560160672;48.687747132;61102;CHATELLIER
La Varenne à Saint-Fraimbault [Moulin Crinais];-0.675492866;48.497301869;61387;SAINT-FRAIMBAULT
La Colmont à Lesbois [La Bigottière];-0.807401784;48.441951021;53131;LESBOIS
La Colmont à Oisseau;-0.663845692;48.361228461;53170;OISSEAU
La Mayenne à Mayenne et à Saint-Baudelle;-0.628936051;48.281513935;53200;SAINT-BAUDELLE
La Mayenne à Mayenne et à Saint-Baudelle;-0.619974773;48.298775506;53147;MAYENNE
La Mayenne à Saint-Fraimbault-de-Prières;-0.583996379;48.350063921;53216;SAINT-FRAIMBAULT-DE-PRIERES
La Mayenne à Saint-Fraimbault-de-Prières;-0.587852044;48.364000398;53216;SAINT-FRAIMBAULT-DE-PRIERES
[Le Montanger] à la Haie-Traversaine;-0.630613063;48.332071382;53111;HAIE-TRAVERSAINE
L'Aron à Moulay;-0.625655091;48.268941852;53162;MOULAY
Le Fresne à Châlons-du-Maine [Les Valettes];-0.673037924;48.166405058;53049;CHALONS-DU-MAINE
Le Fresne à Louverné [Méziere];-0.724398871;48.149660661;53140;LOUVERNE
L'Ernée à Ernée;-0.944831428;48.297590424;53096;ERNEE
L'Ernée à Andouillé [Les Vaugeois];-0.775683278;48.166352793;53005;ANDOUILLE
La Mayenne à Laval;-0.770167417;48.070839048;53130;LAVAL
La Mayenne à l'Huisserie [Bonne];-0.740834152;48.012261497;53119;HUISSERIE
La Jouanne à Neau [La Touche];-0.475538705;48.153907246;53163;NEAU
La Jouanne à Forcé;-0.705181179;48.033669266;53099;FORCE
Le Vicoin à Nuillé-sur-Vicoin;-0.782662403;47.987318643;53168;NUILLE-SUR-VICOIN
L'Ouette à Entrammes;-0.706485492;47.970592081;53094;ENTRAMMES
La Mayenne à Château-Gontier;-0.699220103;47.818090757;53062;CHATEAU-GONTIER
La Mayenne à Chambellay;-0.688248977;47.678119693;49064;CHAMBELLAY
L'Oudon à Cossé-le-Vivien;-0.927737797;47.934894222;53077;COSSE-LE-VIVIEN
L'Oudon à Craon;-0.954770283;47.846994449;53084;CRAON
L'Usure à Saint-Michel-de-la-Roë [La Gouranderie];-1.115709159;47.870607259;53242;SAINT-MICHEL-DE-LA-ROE
L'Oudon à Châtelais [Marcillé];-0.926741344;47.774062456;49081;CHATELAIS
Le Chéran à la Boissière;-0.986499333;47.7837125;53033;BOISSIERE
La Verzée à Noëllet [Le Douet];-1.074778693;47.699100676;49226;NOELLET
La Nymphe à Noëllet;-1.0923595;47.695773492;49226;NOELLET
La Verzée au Bourg-d'Iré [La Pommeraye];-0.951341311;47.678907623;49037;BOURG-D'IRE
L'Argos à Marans et à Sainte-Gemmes-d'Andigné;-0.866716336;47.64585467;49277;SAINTE-GEMMES-D'ANDIGNE
L'Argos à Marans et à Sainte-Gemmes-d'Andigné;-0.86954348;47.6498974;49187;MARANS
L'Argos à Marans et à Sainte-Gemmes-d'Andigné;-0.865652216;47.655640585;49187;MARANS
L'Oudon à Segré [écluse de Maingué];-0.860742011;47.686370346;49331;SEGRE-EN-ANJOU BLEU
L'Oudon à Segré [écluse de Maingué];-0.867985144;47.685770335;49331;SEGRE-EN-ANJOU BLEU
[Le Tileul] à Saint-Sauveur-de-Flée;-0.79412028;47.751178913;49319;SAINT-SAUVEUR-DE-FLEE
L'Oudon à Andigné [Port aux Anglais];-0.76553957;47.66770637;49005;ANDIGNE
La Maine à Angers;-0.558902963;47.471557862;49007;ANGERS
La Maine à Angers;-0.554044115;47.477437234;49007;ANGERS
La Maine à Angers;-0.563072231;47.470105687;49007;ANGERS
Le Brionneau à Avrillé [La Poële];-0.610791203;47.496046592;49015;AVRILLE
La Loire à Bouchemaine et à la Possonnière;-0.62123944;47.40607791;49035;BOUCHEMAINE
La Loire à Bouchemaine et à la Possonnière;-0.683961153;47.370970145;49247;POSSONNIERE
L'Aubance à Soulaines-sur-Aubance;-0.518513985;47.375531763;49338;SOULAINES-SUR-AUBANCE
L'Aubance à Soulaines-sur-Aubance;-0.509225007;47.375686585;49338;SOULAINES-SUR-AUBANCE
Le Layon à Saint-Georges-sur-Layon;-0.374479334;47.19299553;49282;SAINT-GEORGES-SUR-LAYON
La Gaubretière à Cléré-sur-Layon [Le Mureau];-0.449786921;47.08118619;49102;CLERE-SUR-LAYON
Le Girondeau à Martigné-Briand;-0.419850941;47.224005242;49191;MARTIGNE-BRIAND
Le Lys à Aubigné-sur-Layon [La Guimardière];-0.481930752;47.223633643;49012;AUBIGNE-SUR-LAYON
L'Hyrôme à Chanzeaux et à Saint-Lambert-du-Lattay;-0.646094421;47.266527146;49071;CHANZEAUX
L'Hyrôme à Chanzeaux et à Saint-Lambert-du-Lattay;-0.621667188;47.302060918;49292;VAL-DU-LAYON
L'Aubance à Chemillé [La Chaperonnière];-0.751337853;47.224612287;49092;CHEMILLE-EN-ANJOU
Le Layon à Saint-Lambert-du-Lattay;-0.632160202;47.316359144;49292;VAL-DU-LAYON
La Loire à Chalonnes-sur-Loire et à Ingrandes et à Montjean-sur-Loire et à Saint-Florent-le-Vieil;-0.861086835;47.392237172;49212;MONTJEAN-SUR-LOIRE
La Loire à Chalonnes-sur-Loire et à Ingrandes et à Montjean-sur-Loire et à Saint-Florent-le-Vieil;-0.762216653;47.353951667;49063;CHALONNES-SUR-LOIRE
La Loire à Chalonnes-sur-Loire et à Ingrandes et à Montjean-sur-Loire et à Saint-Florent-le-Vieil;-0.922009552;47.402229136;49160;INGRANDES-LE FRESNE SUR LOIRE
La Loire à Chalonnes-sur-Loire et à Ingrandes et à Montjean-sur-Loire et à Saint-Florent-le-Vieil;-1.014710679;47.364279341;49276;SAINT-FLORENT-LE-VIEIL
L'Evre à la Chapelle-Saint-Florent;-1.052109041;47.310211581;49075;CHAPELLE-SAINT-FLORENT
L'Evre à la Chapelle-Saint-Florent;-1.061397413;47.29354379;49075;CHAPELLE-SAINT-FLORENT
L'Evre à Beaupréau [Moulin de la Gobinière];-0.968529579;47.192602509;49023;BEAUPREAU-EN-MAUGES
Le Beuvron à Andrezé [Tuvache];-0.962136555;47.177984237;49006;ANDREZE
La Loire à Ancenis et à Oudon;-1.177255859;47.363503314;44003;ANCENIS
La Loire à Ancenis et à Oudon;-1.278297624;47.340765312;44115;OUDON
Le Hâvre à Mésanger [Pont-Esnault];-1.297688931;47.420033806;44096;MESANGER
La Divatte à Landemont;-1.263637019;47.259137251;49172;LANDEMONT
La Loire à Mauves-sur-Loire et à Sainte-Luce-sur-Loire et à Thouaré-sur-Loire;-1.379007553;47.295597324;44094;MAUVES-SUR-LOIRE
La Loire à Mauves-sur-Loire et à Sainte-Luce-sur-Loire et à Thouaré-sur-Loire;-1.429092472;47.258674159;44204;THOUARE-SUR-LOIRE
La Loire à Mauves-sur-Loire et à Sainte-Luce-sur-Loire et à Thouaré-sur-Loire;-1.468840305;47.229718036;44172;SAINTE-LUCE-SUR-LOIRE
Le Pont Ménard à la Cornuaille [La Giraudaie];-1.015354223;47.544300501;49108;CORNUAILLE
[Les Grands Gués] à Angrie [Les Tuyas];-1.03312556;47.571987855;49008;ANGRIE
L'Erdre à Candé et à Saint-Mars-la-Jaille;-1.047996595;47.559791392;49054;CANDE
L'Erdre à Candé et à Saint-Mars-la-Jaille;-1.17867915;47.52488284;44180;VALLONS-DE-L'ERDRE
Le Croissel à Saint-Mars-la-Jaille;-1.168251738;47.522912838;44180;VALLONS-DE-L'ERDRE
L'Erdre à Bonnœuvre [Les Basses Provostières];-1.272396868;47.51772337;44017;BONN≈íUVRE
L'Erdre à Nort-sur-Erdre [Moulin de Vault];-1.48218338;47.464394888;44110;NORT-SUR-ERDRE
Le Cens à Orvault;-1.623073255;47.267634634;44114;ORVAULT
Le Cens à Orvault [Pont du Cens];-1.57867275;47.248927377;44114;ORVAULT
Le Gesvres à Treillières;-1.616064368;47.320325654;44209;TREILLIERES
L'Ouine au Breuil-Bernard [Les Alleuds];-0.555234501;46.701244389;79051;BREUIL-BERNARD
La Sèvre Nantaise à l'Absie;-0.532366256;46.660868806;79001;ABSIE
La Sèvre Nantaise à Saint-Mesmin [La Branle];-0.700056248;46.810942065;85254;SAINT-MESMIN
La Sèvre Nantaise à Saint-Laurent-sur-Sèvre;-0.888052612;46.959047727;85238;SAINT-LAURENT-SUR-SEVRE
L'Ouin à Mauléon [La Voie Moulins];-0.799835502;46.964018371;79079;MAULEON
La Sèvre Nantaise à Tiffauges;-1.114538039;47.01881824;85293;TIFFAUGES
La Sèvre Nantaise à Tiffauges;-1.113383445;47.017456988;85293;TIFFAUGES
La Moine à Maulévrier [La Rousselière];-0.812300559;47.010416076;49192;MAULEVRIER
La Moine à Cholet [Pont RN249];-0.92520974;47.054558794;49099;CHOLET
Le Trézon à Mazières-en-Mauges;-0.775454608;47.047709363;49195;MAZIERES-EN-MAUGES
La Moine à Roussay [Clopin];-1.05738667;47.095875322;49263;ROUSSAY
La Moine à Saint-Crespin-sur-Moine;-1.184770951;47.095730617;49273;SAINT-CRESPIN-SUR-MOINE
La Sèvre Nantaise à Clisson;-1.278169853;47.086637956;44043;CLISSON
La Sèvre Nantaise à Clisson;-1.281623582;47.090729635;44043;CLISSON
La Sanguèze à Tillières [Moulin Pichon];-1.222235186;47.141331259;49349;TILLIERES
La Maine à Saint-Fulgent [Plessis des Landes];-1.157150664;46.903571666;85215;SAINT-FULGENT
La Petite Maine à Saint-Georges-de-Montaigu [Fromage];-1.273250678;46.922745447;85217;SAINT-GEORGES-DE-MONTAIGU
La Maine à Remouillé;-1.371328829;47.055701651;44142;REMOUILLE
La Sèvre Nantaise à Vertou;-1.482470558;47.165240584;44215;VERTOU
La Loire à Nantes;-1.566759232;47.208808864;44109;NANTES
La Loire à Nantes;-1.539972094;47.211594013;44109;NANTES
La Boulogne à Rocheservière et à Saint-Philbert-de-Bouaine;-1.530453591;46.945431346;85190;ROCHESERVIERE
La Boulogne à Rocheservière et à Saint-Philbert-de-Bouaine;-1.548189118;46.994351763;85262;SAINT-PHILBERT-DE-BOUAINE
L'Issoire à Saint-Philbert-de-Bouaine [La Tribouille];-1.5411152;46.99079785;85262;SAINT-PHILBERT-DE-BOUAINE
La Logne à Saint-Colomban [La Roussière];-1.590247694;47.015871539;44155;SAINT-COLOMBAN
La Logne à Legé [Le Paradis];-1.605250055;46.883760294;44081;LEGE
L'Ognon à Montbert;-1.467986297;47.039240282;44102;MONTBERT
L'Ognon aux Sorinières [Villeneuve];-1.532277484;47.121601117;44198;SORINIERES
Le Brivet à Pontchâteau;-2.089825012;47.436505137;44129;PONTCHATEAU
Le Falleron à Falleron;-1.703338326;46.887458226;85086;FALLERON
Le Falleron à Machecoul [Le Bas Falleron];-1.796051509;46.978658079;44087;MACHECOUL-SAINT-MEME
Le Falleron à Saint-Étienne-de-Mer-Morte;-1.748918599;46.930523019;44157;SAINT-ETIENNE-DE-MER-MORTE
Le Pont Abert à la Coudrie à Challans;-1.882539211;46.865323099;85047;CHALLANS
La Vie à la Chapelle-Palluau;-1.618007718;46.776983892;85055;CHAPELLE-PALLUAU
La Petite Boulogne à la Chapelle-Palluau [La Birochère];-1.653743538;46.789205569;85055;CHAPELLE-PALLUAU
Le Jaunay à Landevieille [Savarière];-1.78698696;46.658728503;85120;LANDEVIEILLE
Le Jaunay à la Chapelle-Hermier [Reveillère];-1.717012625;46.671698006;85054;CHAPELLE-HERMIER
Le Jaunay à la Chapelle-Hermier [Reveillère];-1.712179601;46.671725492;85054;CHAPELLE-HERMIER
L'Auzance à Vairé [Petit Besson];-1.73907858;46.58025743;85298;VAIRE
