libelle;longitude;latitude;code_commune_station;libelle_commune
[Barbotteau] à Petit-Bourg;-61.658989597;16.189402471;97118;PETIT-BOURG
[Grande riviere a goyave] à Petit-Bourg;-61.651949755;16.19582925;97118;PETIT-BOURG
[La Grande Rivière à Goyaves à Petit-Bourg-Barboteau] à Petit-Bourg;-61.65561032;16.193954427;97118;PETIT-BOURG
[La Grande Rivière à Goyaves à Petit-Bourg [Vernou]] à Petit-Bourg;-61.672778414;16.158271038;97118;PETIT-BOURG
La rivière Bras David à Petit-Bourg [Maison Forêt];-61.69319975;16.175997699;97118;PETIT-BOURG
[Prise d'eau Duclos] à Petit-Bourg;-61.666435864;16.199136863;97118;PETIT-BOURG
[La rivière Bras David à Petit-Bourg [cote 110]] à Petit-Bourg;-61.657233929;16.202822061;97118;PETIT-BOURG
[Petit-Bourg [cote 130]] à Petit-Bourg [Riviere bras david];-61.673385354;16.193433429;97118;PETIT-BOURG
[Grande riviere a goyave] à Petit-Bourg [Prise d'eau, cote 90];-61.653093292;16.205118648;97118;PETIT-BOURG
[Lamentin [Ravine Chaude]] à Lamentin [Lamentin [Ravine Chaude]];-61.668681698;16.225308732;97115;LAMENTIN
[La Boucan] à Sainte-Rose;-61.668130065;16.27971171;97129;SAINTE-ROSE
[Sainte-Rose [Bonne Mere]] à Sainte-Rose [Grande riviere a goyave];-61.667993471;16.271941152;97129;SAINTE-ROSE
[Ravine Bleue] à Sainte-Rose;-61.717770023;16.293870123;97129;SAINTE-ROSE
[Sainte-Rose [Forêt de Marolles]] à Sainte-Rose [Riviere moustique sainte-rose];-61.715113667;16.296798381;97129;SAINTE-ROSE
[Riviere nogent] à Sainte-Rose;-61.745007441;16.336032497;97129;SAINTE-ROSE
[Prise d'eau] à Petit-Bourg [TRIANON];-61.627892425;16.157941415;97118;PETIT-BOURG
[pont RN] à Petit-Bourg;-61.60212418;16.181951987;97118;PETIT-BOURG
[Riviere la rose] à Goyave [cote 75];-61.597352472;16.149653493;97114;GOYAVE
[Riviere lezarde] à Petit-Bourg [cote 85];-61.647192928;16.180126943;97118;PETIT-BOURG
[Prise d'eau] à Capesterre-Belle-Eau [DIGUE];-61.609381528;16.071929809;97107;CAPESTERRE-BELLE-EAU
[pont RN] à Capesterre-Belle-Eau;-61.56608824;16.057036348;97107;CAPESTERRE-BELLE-EAU
[Capesterre-Belle-Eau [cote 95]] à Capesterre-Belle-Eau;-61.585446667;16.066805019;97107;CAPESTERRE-BELLE-EAU
[Riviere du Perou] à Capesterre-Belle-Eau [cote 205];-61.603401793;16.057559475;97107;CAPESTERRE-BELLE-EAU
[Riviere du Grand Carbet] à Capesterre-Belle-Eau [Amont prise Marquis];-61.605619672;16.039714664;97107;CAPESTERRE-BELLE-EAU
[Riviere du Grand Carbet] à Capesterre-Belle-Eau [Cote 15];-61.57502155;16.022531066;97107;CAPESTERRE-BELLE-EAU
[Riviere du Grand Carbet] à Capesterre-Belle-Eau [Barrage];-61.623693349;16.045389917;97107;CAPESTERRE-BELLE-EAU
[riviere Moreau] à Goyave [cote 170];-61.615206314;16.123740687;97114;GOYAVE
[Petite Riviere A Goyave] à Goyave;-61.587337245;16.127263578;97114;GOYAVE
[riviere Sainte Marie] à Capesterre-Belle-Eau;-61.562456953;16.100001781;97107;CAPESTERRE-BELLE-EAU
[Pont RD] à Trois-Rivières [Grande Anse];-61.659512131;15.963211632;97132;TROIS-RIVIERES
[riviere Bananier] à Capesterre-Belle-Eau [Pont Thévenin];-61.609276275;16.019158627;97107;CAPESTERRE-BELLE-EAU
[riviere Bananier] à Capesterre-Belle-Eau [Déversoir à l'échelle];-61.615413076;16.02500079;97107;CAPESTERRE-BELLE-EAU
[rivière Bananier] à Capesterre-Belle-Eau [Déversoir au limnigraphe];-61.615282247;16.024999945;97107;CAPESTERRE-BELLE-EAU
[Rivière des Pères] à Baillif [Rivière des Pères];-61.739269766;16.010759526;97104;BAILLIF
[riviere aux Herbes] à Basse-Terre;-61.725152838;15.996332898;97105;BASSE-TERRE
[Galion] à Basse-Terre;-61.720413666;15.989236632;97105;BASSE-TERRE
[riviere du Plessis] à Baillif;-61.718538802;16.067742559;97104;BAILLIF
[Grande Riviere de Vieux-Habitants] à Vieux-Habitants [cote 570];-61.695519784;16.110056606;97134;VIEUX-HABITANTS
[Grande Riviere de Vieux-Habitants] à Vieux-Habitants [cote 325];-61.717583131;16.101603762;97134;VIEUX-HABITANTS
[Prise d'eau] à Vieux-Habitants [Barthole];-61.725180957;16.086536891;97134;VIEUX-HABITANTS
[Pont RN] à Vieux-Habitants;-61.759929533;16.059657043;97134;VIEUX-HABITANTS
[riviere Beaugendre] à Vieux-Habitants [cote 77];-61.74909047;16.098599964;97134;VIEUX-HABITANTS
[pont RD] à Bouillante [Lostau];-61.765614739;16.162251555;97106;BOUILLANTE
[riviere Lostau] à Bouillante [cote 70];-61.757070717;16.160722892;97106;BOUILLANTE
[rivière Lostau] à Bouillante [Déversoir];-61.750553449;16.162022446;97106;BOUILLANTE
La rivière de Petite-Plaine à Pointe-Noire;-61.776039409;16.224316529;97121;POINTE-NOIRE
[riviere Petite Plaine] à Pointe-Noire [Historique];-61.746477755;16.067971261;97121;POINTE-NOIRE
[riviere Ferry] à Deshaies [cote 35];-61.79058361;16.285746742;97111;DESHAIES
La rivière Deshaies à Deshaies;-61.782868367;16.29672549;97111;DESHAIES
[ravine Bacadore] aux Abymes;-61.508468286;16.255793409;97101;ABYMES
La ravine des Coudes [MAE] à Morne-à-l'Eau;-61.440836092;16.329290583;97116;MORNE-A-L'EAU
[ravine Gaschet] à Petit-Canal;-61.441215057;16.40045727;97119;PETIT-CANAL
[ravine Gaschet] à Port-Louis [Pont RN 6];-61.49924553;16.403970454;97122;PORT-LOUIS
[ravine Gaschet] à Port-Louis [Retenue Gachet];-61.488267384;16.415513864;97122;PORT-LOUIS
[ravine Cassis] à Port-Louis [ravine Cassis];-61.508933348;16.441174358;97122;PORT-LOUIS
[ravine Gardel] au Moule;-61.322648953;16.311995675;97117;MOULE
[Ravine Bombo] à Sainte-Anne;-61.3790885;16.252520424;97128;SAINTE-ANNE
[Grande Ravine] au Gosier [Pont RN 4];-61.497841135;16.217444195;97113;GOSIER
[rivière Saint Louis] à Saint-Louis [Marie-Galante];-61.289587036;15.935073394;97126;SAINT-LOUIS
La rivière de l'Anse Céron au Prêcheur;-61.225533373;14.831497784;97219;PRECHEUR
La Grande Rivière à Grand'Rivière [Bourg Grand Rivière];-61.178256371;14.873158238;97211;GRAND'RIVIERE
La Grande Rivière à Grand'Rivière [Bourg Grand Rivière];-61.178256371;14.873158238;97211;GRAND'RIVIERE
La rivière Capot au Morne-Rouge [Mackintosh];-61.11098285;14.776624396;97218;MORNE-ROUGE
La rivière Capot au Lorrain [Saut Babin];-61.106495975;14.812058121;97214;LORRAIN
La rivière Capot au Lorrain [Vivé-capot];-61.096447645;14.831861995;97214;LORRAIN
La rivière Pirogue au Lorrain [Pont Desgrottes];-61.101868228;14.804790393;97214;LORRAIN
La rivière du Lorrain au Lorrain [SCNA];-61.055504668;14.788161638;97214;LORRAIN
La rivière du Lorrain au Lorrain [confluence Pirogue];-61.059176417;14.779809287;97214;LORRAIN
La rivière du Lorrain au Lorrain [Pont de la Pirogue];-61.057075397;14.796735688;97214;LORRAIN
La rivière de Bezaudin à Sainte-Marie [Sainte-Marie];-61.006936513;14.773034836;97228;SAINTE-MARIE
La rivière du Galion Bras Gommier Percé à Gros-Morne [Bras-Gommier];-61.037961962;14.730869121;97212;GROS-MORNE
La rivière du Galion à la Trinité [Grand Galion];-60.960337268;14.717007964;97230;TRINITE
La rivière du Galion à la Trinité [Bassignac];-60.98797774;14.730483451;97230;TRINITE
La rivière du Galion à la Trinité [bassignac];-60.981706085;14.729521489;97230;TRINITE
La rivière Dumauzé à Fort-de-France [Didier];-61.09286828;14.6616867;97209;FORT-DE-FRANCE
La rivière Dumauzé à Fort-de-France [Absalon];-61.097490855;14.676753304;97209;FORT-DE-FRANCE
La rivière Case-Navire à Schœlcher [Anse Madame];-61.100287937;14.618484551;97229;SCH≈íLCHER
La rivière Case-Navire à Schœlcher [Fond Rousseau];-61.097887359;14.626501082;97229;SCH≈íLCHER
La rivière Case-Navire à Schœlcher [case navire];-61.100055406;14.617853328;97229;SCH≈íLCHER
La rivière du Carbet à Fonds-Saint-Denis [fond mascret];-61.141301418;14.729517849;97208;FONDS-SAINT-DENIS
La rivière du Carbet au Carbet [Fond Baise];-61.169082937;14.714960626;97204;CARBET
La Roxelane à Saint-Pierre [Pecoul];-61.163459122;14.757457549;97225;SAINT-PIERRE
La Roxelane à Saint-Pierre [Bourg Saint Pierre];-61.176308059;14.749127233;97225;SAINT-PIERRE
La rivière du Longvilliers au Lamentin [Baleu];-61.016305292;14.648854081;97213;LAMENTIN
La Gondeau au Lamentin [Pont de Gondeau];-61.023931232;14.632474171;97213;LAMENTIN
La Jambette à Fort-de-France [Jambette];-61.034979423;14.632967635;97209;FORT-DE-FRANCE
La rivière Madame à Fort-de-France [Pont de Chaine];-61.071269419;14.61689841;97209;FORT-DE-FRANCE
La rivière Madame à Fort-de-France [Pont de Chaine];-61.071269419;14.61689841;97209;FORT-DE-FRANCE
La rivière Madame à Fort-de-France [Pont de la Cartonnerie];-61.072165027;14.615273483;97209;FORT-DE-FRANCE
La Lézarde à Gros-Morne [Palourde];-61.048843648;14.716331664;97212;GROS-MORNE
La Lézarde à Gros-Morne [Lézarde 2];-61.033428439;14.709559449;97212;GROS-MORNE
La Lézarde à Gros-Morne [rd-15-b- Lezarde];-61.026200998;14.703380604;97212;GROS-MORNE
La Lézarde à Gros-Morne [Tronc commun];-61.022531224;14.700649554;97212;GROS-MORNE
La rivière Petite Lézarde à Gros-Morne [Saint Maurice];-60.993689841;14.675951231;97212;GROS-MORNE
La rivière Blanche à Fort-de-France [Pont de l'Alma];-61.09254523;14.704929928;97209;FORT-DE-FRANCE
La rivière Blanche à Fort-de-France [Alma];-61.093952971;14.705769475;97209;FORT-DE-FRANCE
La rivière Blanche à Saint-Joseph [Bouliki];-61.073444949;14.702960368;97224;SAINT-JOSEPH
La rivière Blanche à Saint-Joseph [Bouliki aval];-61.068678697;14.69963084;97224;SAINT-JOSEPH
La rivière Blanche à Saint-Joseph [aval prise SICSM];-61.03554371;14.68061176;97224;SAINT-JOSEPH
La rivière Blanche à Saint-Joseph [aval prise SICSM];-61.03554371;14.68061176;97224;SAINT-JOSEPH
La rivière Blanche à Saint-Joseph [pt-de-riv-blanche];-61.044226351;14.685145736;97224;SAINT-JOSEPH
La rivière Blanche à Saint-Joseph [Fond Ferret];-61.022964534;14.675805438;97224;SAINT-JOSEPH
La Lézarde au Lamentin [Pont RN 1];-60.985489727;14.62517646;97213;LAMENTIN
La Lézarde au Lamentin [Pont RN 1];-60.985489727;14.62517646;97213;LAMENTIN
La Lézarde au Lamentin [Pont de Mare];-60.998352278;14.651647472;97213;LAMENTIN
La Lézarde au Lamentin [Pont du Soudon];-60.993999657;14.645465054;97213;LAMENTIN
La Lézarde au Lamentin [Gué de la Désirade];-60.995933352;14.666436069;97213;LAMENTIN
au Lamentin [cote 45];-60.965244359;14.643588774;97213;LAMENTIN
La Petite Rivière au Lamentin [Brasserie Lorraine];-60.97419328;14.625094369;97213;LAMENTIN
La Petite Rivière au Lamentin [Brasserie Lorraine];-60.97419328;14.625094369;97213;LAMENTIN
La Lézarde au Lamentin [Ressource];-60.987499011;14.611799759;;
[Canal Mamin] au Lamentin;-60.994998202;14.617685939;97213;LAMENTIN
La Lézarde au Lamentin [pt-Spitz];-60.998224292;14.605747482;97213;LAMENTIN
La rivière Caleçon au Lamentin [Caleçon];-60.962681039;14.613689172;97213;LAMENTIN
La rivière Caleçon au Lamentin [Gaigneron RD];-60.99753845;14.604004971;97213;LAMENTIN
La rivière Caleçon au Lamentin [Autoroute];-61.004323585;14.599954616;97213;LAMENTIN
La ravine Gaschette au Robert [Gaschette];-60.940031396;14.688732455;97222;ROBERT
La rivière Desroses au François [Belle-ame];-60.919731401;14.613149785;97210;FRANCOIS
La rivière Desroses au François [Pont- Martienne];-60.909463185;14.616384816;97210;FRANCOIS
La rivière Deux Courants au François [Séraphin];-60.902648296;14.61368096;97210;FRANCOIS
La rivière du Simon au François [Fontane2];-60.876715582;14.583676836;97210;FRANCOIS
La rivière du Simon au François [Fontane];-60.880462383;14.580573212;97210;FRANCOIS
La rivière de Paquemar au Vauclin [Morne Jalouse];-60.850910104;14.518406682;97232;VAUCLIN
La rivière Massel au Marin [Puyferrat - Pont RN 6];-60.852992932;14.501105405;97217;MARIN
Le Crêve Cœur à Sainte-Anne [cote 10];-60.853616487;14.449215372;97226;SAINTE-ANNE
La rivière les Coulisses à Saint-Esprit [pont-secours];-60.937987677;14.562362799;97223;SAINT-ESPRIT
La rivière les Coulisses à Rivière-Salée [Petit-Bourg];-60.960058505;14.547599077;97221;RIVIERE-SALEE
La rivière les Coulisses à Rivière-Salée [Petit-Bourg];-60.960058505;14.547599077;97221;RIVIERE-SALEE
La rivière de Trenelle à Rivière-Salée [Habitation Boulevard];-60.964644448;14.527102542;97221;RIVIERE-SALEE
La rivière l'Abandon à Rivière-Salée [Pont Violon - RN 5];-60.98144987;14.534648901;97221;RIVIERE-SALEE
La ravine de la Laugier à Rivière-Salée [Laugier];-60.977396267;14.52424337;97221;RIVIERE-SALEE
Le ravin Médecin à Rivière-Salée [Médecin];-60.983282868;14.524137738;97221;RIVIERE-SALEE
La rivière la Manche à Ducos [Pont RN 7];-60.964891696;14.564889911;97207;DUCOS
La Petite Rivière Pilote à Rivière-Pilote [Madeleine];-60.904818828;14.496114205;97220;RIVIERE-PILOTE
La Petite Rivière Pilote à Rivière-Pilote [Pomponne];-60.903969933;14.484987307;97220;RIVIERE-PILOTE
La Grande Rivière Pilote à Rivière-Pilote [lescouet];-60.890072824;14.498893027;97220;RIVIERE-PILOTE
La rivière Oman à Sainte-Luce [Morne Lavison];-60.963652676;14.488462522;97227;SAINTE-LUCE
La rivière Oman à Sainte-Luce [Dormante];-60.961577974;14.486141542;97227;SAINTE-LUCE
Le fond Placide au Diamant [Petits Lézards];-61.031695201;14.487280205;97206;DIAMANT
Le Mro wa Gouloué à Mamoudzou [Passamainty];45.205680635;-12.800646373;97611;MAMOUDZOU
Le Mro wa Kwalé à Mamoudzou [Kwalé Station];45.185710871;-12.797179721;97611;MAMOUDZOU
Le Mro wa Mgombani à Koungou [Mgombani];45.178368783;-12.733667893;97610;KOUNGOU
Le Mro wa Tanabé à Bandraboua [Dzoumogné Retenue];45.106868127;-12.715276989;97602;BANDRABOUA
Le Mro wa Mjihari à Bandraboua [Dzoumogné Ouest];45.110914892;-12.722328785;97602;BANDRABOUA
Le Mro wa Mjihari à Bandraboua [Mapouéra];45.099822626;-12.717956433;97602;BANDRABOUA
[La Méresse] à Bandraboua;45.135569806;-12.732029374;97602;BANDRABOUA
Le Mro wa Mouhogoni à Bandraboua [Mouhogoni];45.116986292;-12.724668283;97602;BANDRABOUA
Le Mro wa Bouyouni à Bandraboua [Bouyouni Bas];45.140670399;-12.743791491;97602;BANDRABOUA
Le Mro wa Bouyouni à Tsingoni [Bouyouni Haut];45.148436832;-12.760561754;97617;TSINGONI
Le Mro wa Longoni à Koungou [Longoni];45.164894403;-12.73753793;97610;KOUNGOU
Le Mroni Boungoumouhé à M'Tsangamouji [Boungoumouhé];45.098430035;-12.761317582;97613;M'TSANGAMOUJI
Le Mro wa Chirini à Tsingoni [Soulou];45.106967053;-12.775430173;97617;TSINGONI
Le Mrowalé à Tsingoni [Mrowalé];45.110564284;-12.784688572;97617;TSINGONI
Le Mro wa Ourovéni à Tsingoni [Mouala];45.146913736;-12.771350726;97617;TSINGONI
Le Mro wa Ourovéni à Tsingoni [Ouroveni Pont];45.127685913;-12.808210302;97617;TSINGONI
Le Mro wa Coconi à Ouangani [Hapandzo];45.132076288;-12.834061555;97614;OUANGANI
Le Mroni Antanana à Kani-Kéli [Mronabéja];45.129723012;-12.97068984;97609;KANI-KELI
Le Mroni Bé à Bandrele [Bé Dapani];45.158037662;-12.968467768;97603;BANDRELE
Le Mro wa Dembéni à Dembeni [Dembéni Bas];45.177033542;-12.840129963;97607;DEMBENI
Le Mro wa Salim Bé à Dembeni [Salim Bé];45.19411718;-12.873241559;97607;DEMBENI
La rivière des Remparts [Bras Principal] à Saint-Joseph [Pont RN 2];55.615699903;-21.376618691;97412;SAINT-JOSEPH
La rivière des Remparts [Bras Principal] à Saint-Joseph [Pont RN 2];55.615654868;-21.375254291;97412;SAINT-JOSEPH
La rivière Langevin [Bras principal] à Saint-Joseph [Barrage];55.644621986;-21.340248013;97412;SAINT-JOSEPH
La rivière Langevin [Bras principal] à Saint-Joseph [Passerelle];55.643387787;-21.33902202;97412;SAINT-JOSEPH
La rivière Langevin [Bras principal] à Saint-Joseph;55.645672686;-21.381009615;97412;SAINT-JOSEPH
La rivière de l'Est [Bras Principal] à Sainte-Rose;55.721976963;-21.175188555;97419;SAINTE-ROSE
Le bras Noir à la Plaine-des-Palmistes;55.585693089;-21.143904766;97406;PLAINE-DES-PALMISTES
La rivière des Marsouins [Bras principal] à Saint-Benoît [Bethléem];55.679712956;-21.04147154;97410;SAINT-BENOIT
La rivière des Marsouins [Bras Principal] à Saint-Benoît [Centre-Ville];55.714487228;-21.035025937;97410;SAINT-BENOIT
La rivière des Roches [Bras Principal] à Saint-Benoît [Abondance];55.6599349;-21.035399628;97410;SAINT-BENOIT
La rivière des Roches [Bras Principal] à Saint-Benoît [Bassin La Paix];55.670555899;-21.023693915;97410;SAINT-BENOIT
La rivière Bras Panon à Bras-Panon [Aval radier Paniandy];55.663069594;-20.996786781;97402;BRAS-PANON
La rivière Bras Panon à Bras-Panon [Libéria];55.675198473;-21.003521471;97402;BRAS-PANON
La rivière du Mât [Bras Principal] à Salazie [Pont de l'Escalier];55.579492877;-20.998919379;97421;SALAZIE
La rivière du Mât [Bras Principal] à Salazie [Trou Blanc];55.493714767;-21.061325083;97421;SALAZIE
Le bras des Lianes à Bras-Panon [Amont cascade du Chien];55.61149735;-21.025986285;97402;BRAS-PANON
La rivière du Mât [Bras principal] à Bras-Panon [Barrage Bengalis];55.640255699;-20.978258533;97402;BRAS-PANON
La Grande Rivière Saint-Jean [Bras principal] à Sainte-Suzanne [Pont RN 2002];55.641920525;-20.932353037;97420;SAINTE-SUZANNE
La Grande Rivière Saint-Jean [Bras principal] à Saint-André [Grand Bras];55.605666402;-20.969053684;97409;SAINT-ANDRE
La Petite Rivière Saint-Jean [Affluent] à Sainte-Suzanne [Cascade Délice];55.633827755;-20.93620008;97420;SAINTE-SUZANNE
La rivière Sainte-Suzanne [Bras principal] à Sainte-Suzanne [Amont Cascade Niagara];55.602405419;-20.921464584;97420;SAINTE-SUZANNE
La rivière Sainte-Suzanne [Bras principal] à Sainte-Suzanne [Bassin ravine Creuse];55.578183881;-20.960814626;97420;SAINTE-SUZANNE
Le bras Laurent [Affluent] à Sainte-Suzanne;55.568599139;-20.975142151;97420;SAINTE-SUZANNE
La rivière Sainte-Suzanne à Sainte-Suzanne [Bassin Grondin];55.582434329;-20.951219368;97420;SAINTE-SUZANNE
La rivière Sainte-Suzanne à Sainte-Suzanne;55.564220224;-20.975421481;97420;SAINTE-SUZANNE
La Grande Rivière Saint-Jean à Saint-André [Amont Cascade Pichon];55.63799635;-20.94841096;97409;SAINT-ANDRE
La rivière Sainte-Suzanne [Bras Principal] à Sainte-Suzanne [En aval du bassin Ravine Creuse];55.578392671;-20.960661983;97420;SAINTE-SUZANNE
La rivière des Pluies [Bras Principal] à Saint-Denis [Pont Desbassyns];55.509635427;-20.916416225;97411;SAINT-DENIS
La rivière des Pluies [Bras Principal] à Saint-Denis [Piton Tanan];55.68834393;-20.971101281;97411;SAINT-DENIS
La ravine Mère Canal à Sainte-Marie;55.518391978;-20.975236896;97418;SAINTE-MARIE
La ravine des Patates à Durand [Bras principal] à Saint-Denis;55.472893068;-20.893345654;97411;SAINT-DENIS
La ravine du Butor [Bras principal] à Saint-Denis;55.464660969;-20.888041608;97411;SAINT-DENIS
La rivière Saint-Denis [Bras principal] à Saint-Denis [Seuil Bourbon];55.445329971;-20.883458667;97411;SAINT-DENIS
La rivière Saint-Denis [Bras principal] à Saint-Denis [Amont prise d'eau Bellepierre];55.433358102;-20.908028161;97411;SAINT-DENIS
La rivière des Galets [Bras Principal] à la Possession et à Saint-Paul;55.403954009;-21.020994405;97415;SAINT-PAUL
Le bras Sainte-Suzanne [Affluent] à la Possession [Prise ILO];55.406119298;-20.992858769;97408;POSSESSION
La rivière des Galets à la Possession;55.383883783;-20.997951506;97408;POSSESSION
L'étang Saint-Paul [Etang] à Saint-Paul;55.288710268;-20.989957783;97415;SAINT-PAUL
La ravine Bernica [Bras Principal] à Saint-Paul;55.309595961;-21.058356126;97415;SAINT-PAUL
La ravine Saint-Gilles [Bras principal] à Saint-Paul [Pont RN 1a];55.229631108;-21.052327664;97415;SAINT-PAUL
La ravine Saint-Gilles [Bras Principal] à Saint-Paul [Le Verrou];55.238226885;-21.048767947;97415;SAINT-PAUL
La ravine Saint-Gilles [Bras Principal] à Saint-Paul [Le Verrou];55.238226885;-21.048767947;97415;SAINT-PAUL
La ravine du Grand Étang [Bras Principal] à Saint-Leu [Pont du Centre-Ville];55.287934952;-21.168595843;97413;SAINT-LEU
La ravine du Grand Étang [Bras Principal] à Saint-Leu [Pont de la RN 1A];55.290258953;-21.168312252;97413;SAINT-LEU
La ravine du Petit Étang [Bras Principal] à Saint-Leu [Pont du Centre-Ville];55.288075395;-21.169780518;97413;SAINT-LEU
Le bras de Sainte-Suzanne au Tampon;55.534590444;-21.181247256;97422;TAMPON
La ravine des Cabris [Bras Principal] à Saint-Pierre [Pont de la RN 1];55.442894906;-21.316688854;97416;SAINT-PIERRE
La ravine des Cabris [Bras Principal] à Saint-Pierre [Pont de la RN 3];55.497932157;-21.277507367;97416;SAINT-PIERRE
La ravine Blanche [Bras Principal] à Saint-Pierre [Abattoir ZI n°1];55.458790109;-21.333392557;97416;SAINT-PIERRE
La ravine Blanche [Bras Principal] à Saint-Pierre [Pont de la RD 3];55.513644261;-21.276246638;97416;SAINT-PIERRE
La ravine Blanche [Bras Principal] au Tampon [Plaine des Cafres];55.593253499;-21.215006669;97422;TAMPON
La ravine Blanche [Bras Principal] à Saint-Pierre [La Chatoire];55.503628871;-21.284079951;97416;SAINT-PIERRE
La ravine Blanche [Bras principal] au Tampon [Pont de la RN 3];55.52487778;-21.265984391;97422;TAMPON
La rivière d'Abord [Bras Principal] à Saint-Pierre [Mon Caprice];55.500726674;-21.308904026;97416;SAINT-PIERRE
Le Maroni à Apatou [Langa Tabiki];-54.437026296;4.986284467;97360;APATOU
Le Maroni à Saint-Laurent-du-Maroni;-54.036170715;5.493567718;97311;SAINT-LAURENT-DU-MARONI
"La crique Balaté (Branche Ouest); crique Balaté à Saint-Laurent-du-Maroni [Balaté]";;;;
"La Tapanahoni; Tapanahoni supérieure à Grand-Santi [Kio Konde]";;;;
Le Maroni [Lawa] à Maripasoula [Taluen];-54.052123842;3.384427262;97353;MARIPASOULA
Le Maroni [Le Lawa] à Maripasoula;-54.024466036;3.647586494;97353;MARIPASOULA
Le Maroni [Lawa] à Papaichton;-54.142595126;3.805435012;97362;PAPAICHTON
Le Maroni [Le Lawa] à Grand-Santi;-54.381705873;4.271536889;97357;GRAND-SANTI
Le Maroni [La Litani] à Maripasoula [Kalewat];-54.189616188;3.199926168;97353;MARIPASOULA
Le Maroni [La Litani] à Maripasoula;-54.119527324;3.279467073;97353;MARIPASOULA
Le Maroni [La Litani] à Maripasoula;-54.071830172;3.295289409;97353;MARIPASOULA
La Malani à Maripasoula [Aloupata];-54.088677656;3.225621995;97353;MARIPASOULA
La Tampok à Maripasoula [Degrad Roche];-53.832881668;3.405833417;97353;MARIPASOULA
La Tampok à Maripasoula [Degrad Roche];-53.930172891;3.393217089;97353;MARIPASOULA
L'Oyapock à Camopi;-52.32699647;3.171688901;97356;CAMOPI
L'Oyapock à Camopi;-52.322583447;3.171667805;97356;CAMOPI
L'Oyapock à Saint-Georges [Saut Maripa];-51.884756948;3.801667815;97308;SAINT-GEORGES
La Camopi à Camopi [Bienvenue];-52.36704657;3.178691204;97356;CAMOPI
La Camopi à Camopi [Saut Mombin];-52.38324561;3.180794963;97356;CAMOPI
La Camopi à Camopi [Saut Chien];-52.488043995;3.176090312;97356;CAMOPI
[Oyapock à Trois Sauts] à Camopi;-52.872735355;2.25838631;97356;CAMOPI
L'Oyapock à Camopi [Alikoto];-52.330644036;3.081554738;97356;CAMOPI
La Mana à Mana [Saut Chien];-53.722771782;4.878134131;97306;MANA
La Mana à Mana [Saut Sabbat];-53.672679099;5.384362248;97306;MANA
L'Approuague à Régina [Saut Grand Kanori];-52.669731887;3.616710407;97301;REGINA
L'Approuague à Régina [Pierrette];-52.560331985;4.019507259;97301;REGINA
L'Approuague à Régina [Saut Athanase];-52.321934053;4.187812533;97301;REGINA
Le Sinnamary à Saint-Élie [Saut Dalles];-52.886753864;4.549414056;97358;SAINT-ELIE
Le Koursibo à Saint-Élie [Saut l'Autel];-53.110283097;4.741412715;97358;SAINT-ELIE
La crique Leblond à Saint-Élie [Crique Leblond];-53.152725422;4.732530656;97358;SAINT-ELIE
Le Koursibo à Saint-Élie [Adieu Vat];-53.012364368;4.882972746;97358;SAINT-ELIE
Le Sinnamary à Saint-Élie [Saut Tigre];-53.03357645;4.966962885;97358;SAINT-ELIE
Le Sinnamary à Sinnamary [Petit Saut];-53.044362163;5.066750236;97312;SINNAMARY
Le Sinnamary à Sinnamary [Petit Saut];-53.058342664;5.071379993;97312;SINNAMARY
La crique Grégoire à Sinnamary;-53.071215814;5.09059564;97312;SINNAMARY
La crique Grégoire à Sinnamary;-53.053170916;5.092407374;97312;SINNAMARY
La crique Grégoire à Sinnamary;-53.04852589;5.094754722;97312;SINNAMARY
La crique Toussaint à Sinnamary [Crique Toussaint];-53.003849668;5.35882275;97312;SINNAMARY
Le Mahury [La Comté] à Roura [Saut Bief];-52.510677659;4.535551791;97310;ROURA
L'Orapu à Roura [Saut Bernard];-52.385968173;4.45795925;97310;ROURA
La rivière de Kounana à Roura [Degrad Lalanne];-52.262592691;4.536543916;97310;ROURA
La crique Bellevue [La rivière des Cascades] à Montsinéry-Tonnegrande [Cascade];-52.468595189;4.754533934;97313;MONTSINERY-TONNEGRANDE
La rivière de Tonnégrande à Montsinéry-Tonnegrande;-52.521056907;4.818565758;97313;MONTSINERY-TONNEGRANDE
La rivière de Tonnégrande à Montsinéry-Tonnegrande;-52.536600756;4.815266118;97313;MONTSINERY-TONNEGRANDE
Le Kourou à Kourou [Roche Léodate];-52.790250953;4.89644235;97304;KOUROU
Le Kourou à Kourou [Roche Léodate];-52.792182043;4.897142476;97304;KOUROU
La crique Passoura à Kourou [Pont déviation RN 1];-52.699673946;5.150361699;97304;KOUROU
La crique Karouabo à Kourou [Pont ancienne RN 1 (CSG)];-52.785487428;5.227193576;97304;KOUROU
Le Rhin en Suisse [Bâle [Rheinhalle]];7.606153158;47.556969907;99140;
L'Augraben à Hégenheim;7.528981528;47.564376836;68126;HEGENHEIM
Le ruisseau le Liesbach à Blotzheim;7.508167695;47.587489322;68042;BLOTZHEIM
[Le Liesbach] à Saint-Louis [Langenhaeuser];7.545293761;47.603575148;68297;SAINT-LOUIS
Le ruisseau l'Augraben à Saint-Louis [Michelfelden];7.556488474;47.596980267;68297;SAINT-LOUIS
Le ruisseau l'Augraben à Bartenheim [La Chaussée];7.514201615;47.639123883;68021;BARTENHEIM
[bassin contre coulées de boues] à Helfrantzkirch;7.402934356;47.603518839;68132;HELFRANTZKIRCH
[bassin contre coulées de boues] à Steinbrunn-le-Haut;7.336371644;47.65948711;68324;STEINBRUNN-LE-HAUT
Le ruisseau Weiherbachgraben [bassin contre coulées de boues] à Landser et à Steinbrunn-le-Bas;7.375372559;47.683850098;68174;LANDSER
Le canal du Rhône au Rhin à Sausheim;7.402299785;47.789660363;68300;SAUSHEIM
Le canal d'irrigation de la Hardt à Hombourg;7.480874862;47.758723631;68144;HOMBOURG
